"1. I livelli massimi del saldo netto da finanziare, in termini di competenza e di cassa, e del ricorso al mercato finanziario, in termini di competenza, di cui all'articolo 21, comma 1-ter, lettera a), della legge 31 dicembre 2009, n. 196, per gli anni 2021, 2022 e 2023, sono indicati nell'allegato 1 annesso alla presente legge. I livelli del ricorso al mercato si intendono al netto delle operazioni effettuate al fine di rimborsare prima della scadenza o di ristrutturare passività preesistenti con ammortamento a carico dello Stato.",
"2. Al fine di dare attuazione a interventi in materia di riforma del sistema fiscale, nello stato di previsione del Ministero dell'economia e delle finanze è istituito un Fondo con una dotazione di 8.000 milioni di euro per l'anno 2022 e di 7.000 milioni di euro annui a decorrere dall'anno 2023, di cui una quota non inferiore a 5.000 milioni di euro e non superiore a 6.000 milioni di euro a decorrere dall'anno 2022 è destinata all'assegno universale e servizi alla famiglia. I predetti interventi sono disposti con appositi provvedimenti normativi, a valere sulle risorse del Fondo di cui al primo periodo.",
"3. Al Fondo di cui al comma 2 sono destinate altresì, a decorrere dall'anno 2022, fermo restando il rispetto degli obiettivi programmatici di finanza pubblica, risorse stimate come maggiori entrate permanenti derivanti dal miglioramento dell'adempimento spontaneo.",
"4. In ciascun anno, ai fini della determinazione delle risorse di cui al comma 3, si considerano le maggiori entrate derivanti dal miglioramento dell'adempimento spontaneo che sono indicate, con riferimento al terzo anno precedente alla predisposizione della legge di bilancio, nell'aggiornamento della Relazione sull'economia non osservata e sull'evasione fiscale e contributiva, redatta ai sensi dell'articolo 10-bis.1, comma 3, della legge 31 dicembre 2009, n. 196, introdotto dall'articolo 2 del decreto legislativo 24 settembre 2015, n. 160. Le maggiori entrate di cui al periodo precedente sono considerate permanenti se per i tre anni successivi a quello oggetto di quantificazione, la somma algebrica della stima della variazione delle entrate derivanti in ciascun anno dal miglioramento dell'adempimento spontaneo risulta non negativa. Qualora tale somma algebrica risulti negativa, l'ammontare delle maggiori entrate permanenti è dato dalla differenza, se positiva, tra l'ammontare delle maggiori entrate di cui al primo periodo e il valore negativo della somma algebrica della variazione delle entrate da miglioramento dell'adempimento spontaneo stimata con riferimento ai tre anni successivi. Se la differenza di cui al periodo precedente è negativa o pari a zero, l'ammontare delle maggiori entrate permanenti è pari a zero.",
"5. Nel rispetto degli obiettivi programmatici di finanza pubblica, la Nota di aggiornamento al documento di economia e finanza indica la quota delle maggiori entrate permanenti rispetto alle previsioni tendenziali formulate per il Documento di economia e finanza, derivanti dal miglioramento dell'adempimento spontaneo e determinate ai sensi del comma 4, da destinare al Fondo di cui al comma 2. Per le regioni a statuto speciale e per le province autonome di Trento e di Bolzano resta fermo quanto previsto dai rispettivi statuti speciali e dalle relative norme di attuazione e le maggiori entrate permanenti rimangono acquisite ai rispettivi bilanci, nelle quote previste dai predetti statuti speciali.",
"6. A decorrere dall'anno 2022, i commi da 431 a 435 dell'articolo 1 della legge 27 dicembre 2013, n. 147, sono abrogati.",
"7. Il Fondo assegno universale e servizi alla famiglia e altre misure correlate, di cui al comma 339 dell'articolo 1 della legge 27 dicembre 2019, n. 160, è incrementato di 3.012,1 milioni di euro per l'anno 2021.",
"8. All'articolo 2 del decreto-legge 5 febbraio 2020, n. 3, convertito, con modificazioni, dalla legge 2 aprile 2020, n. 21, sono apportate le seguenti modificazioni:
a) al comma 1, dopo la parola: 'spetta' sono inserite le seguenti: ', per le prestazioni rese dal 1° luglio 2020 al 31 dicembre 2020,'; b) il comma 2 è sostituito dal seguente: '2. In vista di una revisione strutturale del sistema delle detrazioni fiscali, l'ulteriore detrazione di cui al comma 1 spetta, per le prestazioni rese dal 1° gennaio 2021, nei seguenti importi: a) 960 euro, aumentata del prodotto tra 240 euro e l'importo corrispondente al rapporto tra 35.000 euro, diminuito del reddito complessivo, e 7.000 euro, se l'ammontare del reddito complessivo è superiore a 28.000 euro ma non a 35.000 euro; b) 960 euro, se il reddito complessivo è superiore a 35.000 euro ma non a 40.000 euro; la detrazione spetta per la parte corrispondente al rapporto tra l'importo di 40.000 euro, diminuito del reddito complessivo, e l'importo di 5.000 euro'; c) al comma 3, le parole: 'di cui al comma 1', ovunque ricorrono, sono sostituite dalle seguenti: 'di cui ai commi 1 e 2' e le parole: 'in otto rate di pari ammontare' sono sostituite dalle seguenti: 'in dieci rate di pari ammontare'. (2) (2) Comma così sostituito dall'art. 22-sexies, comma 1, D.L. 31 dicembre 2020, n. 183, convertito, con modificazioni, dalla L. 26 febbraio 2021, n. 21. In precedenza il presente comma era stato sostituito dall'art. 1, comma 1, D.L. 31 dicembre 2020, n. 182, abrogato dall'art. 1, comma 3, della medesima Legge n. 21/2021 a norma del quale restano validi gli atti e i provvedimenti adottati e sono fatti salvi gli effetti prodottisi e i rapporti giuridici sorti sulla base del citato D.L. n. 182/2020. ",
"9. Il Fondo di cui all'articolo 1, comma 7, della legge 27 dicembre 2019, n. 160, è ridotto di 1.150 milioni di euro nell'anno 2021 e di 1.426 milioni di euro annui a decorrere dall'anno 2022.",
"10. Per le nuove assunzioni a tempo indeterminato e per le trasformazioni dei contratti a tempo determinato in contratti a tempo indeterminato effettuate nel biennio 2021-2022, al fine di promuovere l'occupazione giovanile stabile, l'esonero contributivo di cui all'articolo 1, commi da 100 a 105 e 107, della legge 27 dicembre 2017, n. 205, è riconosciuto nella misura del 100 per cento, per un periodo massimo di trentasei mesi, nel limite massimo di importo pari a 6.000 euro annui, con riferimento ai soggetti che alla data della prima assunzione incentivata ai sensi del presente comma e dei commi da 11 a 15 del presente articolo non abbiano compiuto il trentaseiesimo anno di età. Resta ferma l'aliquota di computo delle prestazioni pensionistiche.",
"11. L'esonero contributivo di cui al comma 10, ferme restando le condizioni ivi previste, è riconosciuto per un periodo massimo di quarantotto mesi ai datori di lavoro privati che effettuino assunzioni in una sede o unità produttiva ubicata nelle seguenti regioni: Abruzzo, Molise, Campania, Basilicata, Sicilia, Puglia, Calabria e Sardegna.",
"12. In deroga all'articolo 1, comma 104, della legge 27 dicembre 2017, n. 205, fermi restando i princìpi generali di fruizione degli incentivi di cui all'articolo 31 del decreto legislativo 14 settembre 2015, n. 150, l'esonero contributivo di cui al comma 10 spetta ai datori di lavoro che non abbiano proceduto, nei sei mesi precedenti l'assunzione, né procedano, nei nove mesi successivi alla stessa, a licenziamenti individuali per giustificato motivo oggettivo ovvero a licenziamenti collettivi, ai sensi della legge 23 luglio 1991, n. 223, nei confronti di lavoratori inquadrati con la medesima qualifica nella stessa unità produttiva.",
"13. Le disposizioni di cui ai commi da 10 a 15 non si applicano alle prosecuzioni di contratto e alle assunzioni di cui all'articolo 1, commi 106 e 108, della legge 27 dicembre 2017, n. 205.",
"14. Il beneficio previsto dai commi da 10 a 15 è concesso ai sensi della sezione 3.1 della comunicazione della Commissione europea C(2020) 1863 final, del 19 marzo 2020, recante un « Quadro temporaneo per le misure di aiuto di Stato a sostegno dell'economia nell'attuale emergenza del COVID-19 », e nei limiti e alle condizioni di cui alla medesima comunicazione. L'efficacia delle disposizioni dei commi da 10 a 13 del presente articolo è subordinata, ai sensi dell'articolo 108, paragrafo 3, del Trattato sul funzionamento dell'Unione europea, all'autorizzazione della Commissione europea.",
"15. Alla copertura degli oneri derivanti dai commi da 10 a 14 concorrono, per 200,9 milioni di euro per l'anno 2021 e 139,1 milioni di euro per l'anno 2022, le risorse del Programma Next Generation EU.",
"16. Per le assunzioni di donne lavoratrici effettuate nel biennio 2021-2022, in via sperimentale, l'esonero contributivo di cui all'articolo 4, commi da 9 a 11, della legge 28 giugno 2012, n. 92, è riconosciuto nella misura del 100 per cento nel limite massimo di importo pari a 6.000 euro annui.",
"17. Le assunzioni di cui al comma 16 devono comportare un incremento occupazionale netto calcolato sulla base della differenza tra il numero dei lavoratori occupati rilevato in ciascun mese e il numero dei lavoratori mediamente occupati nei dodici mesi precedenti. Per i dipendenti con contratto di lavoro a tempo parziale, il calcolo è ponderato in base al rapporto tra il numero delle ore pattuite e il numero delle ore che costituiscono l'orario normale di lavoro dei lavoratori a tempo pieno. L'incremento della base occupazionale è considerato al netto delle diminuzioni del numero degli occupati verificatesi in società controllate o collegate ai sensi dell'articolo 2359 del codice civile o facenti capo, anche per interposta persona, allo stesso soggetto.",
"18. Il beneficio previsto dai commi da 16 a 19 è concesso ai sensi della sezione 3.1 della comunicazione della Commissione europea C(2020) 1863 final, del 19 marzo 2020, recante un « Quadro temporaneo per le misure di aiuto di Stato a sostegno dell'economia nell'attuale emergenza del COVID-19 », e nei limiti e alle condizioni di cui alla medesima comunicazione. L'efficacia delle disposizioni dei commi 16 e 17 è subordinata, ai sensi dell'articolo 108, paragrafo 3, del Trattato sul funzionamento dell'Unione europea, all'autorizzazione della Commissione europea.",
"19. Alla copertura degli oneri derivanti dai commi da 16 a 18 si provvede, per 37,5 milioni di euro per l'anno 2021 e 88,5 milioni di euro per l'anno 2022, con le risorse del Programma Next Generation EU.",
"20. Al fine di ridurre gli effetti negativi causati dall'emergenza epidemiologica da COVID-19 sul reddito dei lavoratori autonomi e dei professionisti e di favorire la ripresa della loro attività, è istituito, nello stato di previsione del Ministero del lavoro e delle politiche sociali, il Fondo per l'esonero dai contributi previdenziali dovuti dai lavoratori autonomi e dai professionisti, con una dotazione finanziaria iniziale di 2.500 milioni di euro per l'anno 2021, che costituisce il relativo limite di spesa, destinata a finanziare l'esonero parziale dal pagamento dei contributi previdenziali dovuti dai lavoratori autonomi e dai professionisti iscritti alle gestioni previdenziali dell'Istituto nazionale della previdenza sociale (INPS) e dai professionisti iscritti agli enti gestori di forme obbligatorie di previdenza e assistenza di cui al decreto legislativo 30 giugno 1994, n. 509, e al decreto legislativo 10 febbraio 1996, n. 103, che abbiano percepito nel periodo d'imposta 2019 un reddito complessivo non superiore a 50.000 euro e abbiano subìto un calo del fatturato o dei corrispettivi nell'anno 2020 non inferiore al 33 per cento rispetto a quelli dell'anno 2019. Sono esclusi dall'esonero i premi dovuti all'Istituto nazionale per l'assicurazione contro gli infortuni sul lavoro (INAIL). (3) (4) (5)
(3) Comma così modificato dall'art. 3, comma 1, lett. a), D.L. 22 marzo 2021, n. 41, convertito, con modificazioni, dalla L. 21 maggio 2021, n. 69.
(4) Per il differimento dei termini per la verifica della regolarità contributiva dei lavoratori autonomi e dei professionisti ai fini dell'esonero di cui al presente comma, vedi l'art. 47-bis, comma 1, D.L. 25 maggio 2021, n. 73, convertito, con modificazioni, dalla L. 23 luglio 2021, n. 106.
(5) Vedi, anche, il D.M. 17 maggio 2021.
",
"21. Con uno o più decreti del Ministro del lavoro e delle politiche sociali, di concerto con il Ministro dell'economia e delle finanze, da adottare entro sessanta giorni dalla data di entrata in vigore della presente legge, sono definiti i criteri e le modalità per la concessione dell'esonero di cui al comma 20 nonché la quota del limite di spesa di cui al comma 20 da destinare, in via eccezionale, ai professionisti iscritti agli enti gestori di forme obbligatorie di previdenza e assistenza di cui al decreto legislativo 30 giugno 1994, n. 509, e al decreto legislativo 10 febbraio 1996, n. 103, e i relativi criteri di ripartizione. A valere sulle risorse di cui al comma 20 sono altresì esonerati dal pagamento dei contributi previdenziali i medici, gli infermieri e gli altri professionisti e operatori di cui alla legge 11 gennaio 2018, n. 3, già collocati in quiescenza e assunti per l'emergenza derivante dalla diffusione del COVID-19. (6) (7)
(6) Per il differimento dei termini per la verifica della regolarità contributiva dei lavoratori autonomi e dei professionisti ai fini dell'esonero di cui al presente comma, vedi l'art. 47-bis, comma 1, D.L. 25 maggio 2021, n. 73, convertito, con modificazioni, dalla L. 23 luglio 2021, n. 106.
(7) In attuazione di quanto disposto dal presente comma vedi il D.M. 17 maggio 2021.",
"22. Gli enti previdenziali di cui ai commi 20 e 21 provvedono al monitoraggio del rispetto dei limiti di spesa di cui ai medesimi commi 20 e 21 e comunicano i risultati di tale attività al Ministero del lavoro e delle politiche sociali e al Ministero dell'economia e delle finanze. Qualora dal predetto monitoraggio emerga il verificarsi di scostamenti, anche in via prospettica, rispetto al predetto limite di spesa, non sono adottati altri provvedimenti di concessione dell'esonero. (8)
(8) Per il differimento dei termini per la verifica della regolarità contributiva dei lavoratori autonomi e dei professionisti ai fini dell'esonero di cui al presente comma, vedi l'art. 47-bis, comma 1, D.L. 25 maggio 2021, n. 73, convertito, con modificazioni, dalla L. 23 luglio 2021, n. 106.",
"22-bis. Il beneficio previsto ai commi da 20 a 22 è concesso ai sensi della sezione 3.1 della Comunicazione della Commissione europea recante un ""Quadro temporaneo per le misure di aiuto di Stato a sostegno dell'economia nell'attuale emergenza del COVID-19"" e nei limiti ed alle condizioni di cui alla medesima Comunicazione. L'efficacia delle suddette disposizioni e' subordinata, ai sensi dell'articolo 108, paragrafo 3, del Trattato sul funzionamento dell'Unione europea, all'autorizzazione della Commissione europea. (9) (10)
(9) Comma inserito dall'art. 3, comma 1, lett. b), D.L. 22 marzo 2021, n. 41, convertito, con modificazioni, dalla L. 21 maggio 2021, n. 69.
(10) Per il differimento dei termini per la verifica della regolarità contributiva dei lavoratori autonomi e dei professionisti ai fini dell'esonero di cui al presente comma, vedi l'art. 47-bis, comma 1, D.L. 25 maggio 2021, n. 73, convertito, con modificazioni, dalla L. 23 luglio 2021, n. 106.",
"23. Al fine di sostenere il rientro al lavoro delle lavoratrici madri e di favorire la conciliazione dei tempi di lavoro e dei tempi di cura della famiglia, il Fondo di cui all'articolo 19, comma 1, del decreto-legge 4 luglio 2006, n. 223, convertito, con modificazioni, dalla legge 4 agosto 2006, n. 248, per l'anno 2021, è incrementato di 50 milioni di euro, da destinare al sostegno e alla valorizzazione delle misure organizzative adottate dalle imprese per favorire il rientro al lavoro delle lavoratrici madri dopo il parto.",
" 24. Con decreto del Ministro per le pari opportunita' e la famiglia, di concerto con il Ministro dell'economia e delle finanze, previa intesa in sede di Conferenza unificata, ai sensi dell'articolo 8 del decreto legislativo 28 agosto 1997, n. 281, sono definite le modalita' di attribuzione delle risorse di cui al comma 23.",
"25. All'articolo 4, comma 24, lettera a), della legge 28 giugno 2012, n. 92, dopo le parole: «nascita del figlio» sono aggiunte le seguenti: «, anche in caso di morte perinatale».",
"26. Al comma 1250 dell'articolo 1 della legge 27 dicembre 2006, n. 296, dopo la lettera i) è inserita la seguente:

«i-bis) interventi per il sostegno ai genitori nei casi di morte del figlio. Per le finalità di cui alla presente lettera, il Fondo di cui all'articolo 19, comma 1, del decreto-legge 4 luglio 2006, n. 223, convertito, con modificazioni, dalla legge 4 agosto 2006, n. 248, per l'anno 2021, è incrementato di 500.000 euro per l'anno 2021, da destinare al finanziamento delle associazioni che svolgono attività di assistenza psicologica o psicosociologica a favore dei genitori che subiscono gravi disagi sociali e psicologici in conseguenza della morte del figlio».",
"27. Al fine di garantire e implementare la presenza negli istituti penitenziari di professionalità psicologiche esperte per il trattamento intensificato cognitivo-comportamentale nei confronti degli autori di reati contro le donne e per la prevenzione della recidiva, è autorizzata la spesa di 2 milioni di euro per ciascuno degli anni 2021, 2022 e 2023.",
"28. Per le finalità di cui all'articolo 105-bis del decreto-legge 19 maggio 2020, n. 34, convertito, con modificazioni, dalla legge 17 luglio 2020, n. 77, il Fondo di cui all'articolo 19, comma 3, del decreto-legge 4 luglio 2006, n. 223, convertito, con modificazioni, dalla legge 4 agosto 2006, n. 248, è incrementato di 2 milioni di euro per ciascuno degli anni 2021 e 2022.",
"29. Per le assunzioni effettuate a decorrere dal 1° gennaio 2021, al fine di garantire ai lavoratori assicurati a fini previdenziali presso l'Istituto nazionale di previdenza dei giornalisti italiani «Giovanni Amendola» (INPGI) piena ed effettiva parità di trattamento rispetto agli altri lavoratori dipendenti, le disposizioni legislative statali recanti incentivi alla salvaguardia o all'incremento dell'occupazione riconosciuti in favore dei datori di lavoro per la generalità dei settori economici sotto forma di sgravi o esoneri contributivi si applicano, salvo diversa previsione di legge, ai dipendenti iscritti alla gestione sostitutiva dell'INPGI con riferimento alla contribuzione per essi dovuta. Il relativo onere è posto a carico del bilancio dello Stato, a titolo di fiscalizzazione. L'INPGI invia al Ministero del lavoro e delle politiche sociali, a cadenza semestrale, un apposito rendiconto ai fini del rimborso dei relativi oneri. Ai fini degli adempimenti previsti dal Registro nazionale degli aiuti di Stato, l'INPGI assume la funzione di amministrazione concedente e come tale provvede al monitoraggio, per quanto di competenza, in coerenza con quanto previsto dalla comunicazione della Commissione europea C(2020) 1863 final «Quadro temporaneo per le misure di aiuto di Stato a sostegno dell'economia nell'attuale emergenza del COVID-19», pubblicata nella Gazzetta Ufficiale dell'Unione europea C 091I del 20 marzo 2020.",
"30. Al fine di fronteggiare i maggiori oneri di assistenza derivanti dalla crisi economica e occupazionale conseguente alla diffusione dell'epidemia di COVID-19 e di favorire il riequilibrio della gestione previdenziale sostitutiva dell'INPGI, fino al 31 dicembre 2021 è posto a carico del bilancio dello Stato, a titolo di fiscalizzazione, l'onere, comprensivo delle quote di contribuzione figurativa accreditate, sostenuto dall'INPGI per i trattamenti di cassa integrazione, solidarietà e disoccupazione erogati in favore degli iscritti nei limiti e con le modalità previsti dalla legge ovvero dai regolamenti dell'Istituto vigenti alla data di entrata in vigore della presente legge. L'INPGI invia al Ministero del lavoro e delle politiche sociali, con cadenza semestrale, un rendiconto sulla base del quale è disposto il rimborso dei relativi oneri, al netto del gettito contributivo derivante dalle corrispondenti aliquote contributive versato all'INPGI dai soggetti obbligati, che resta acquisito dal predetto Istituto a titolo di compensazione. Qualora l'ammontare del predetto gettito risulti superiore all'onere sostenuto dall'INPGI, la differenza resta acquisita presso il medesimo Istituto a titolo di acconto in compensazione a valere sul semestre successivo, fermo restando l'obbligo di conguaglio a saldo finale, a credito o a debito, alla data del 31 dicembre 2021.",
"31. Al fine di consentire la piena ed effettiva attuazione delle misure di riforma volte al riequilibrio della gestione previdenziale sostitutiva dell'INPGI, il termine di cui all'articolo 16-quinquies, comma 2, secondo periodo, del decreto-legge 30 aprile 2019, n. 34, convertito, con modificazioni, dalla legge 28 giugno 2019, n. 58, è prorogato al 31 dicembre 2021. Al fine di consentire i necessari approfondimenti sulle misure di riforma di cui al primo periodo, presso la Presidenza del Consiglio dei ministri. - Dipartimento per l'informazione e l'editoria è istituita una commissione tecnica composta da rappresentanti del medesimo Dipartimento, del Ministero del lavoro e delle politiche sociali, del Ministero dell'economia e delle finanze, dell'INPS e dell'INPGI. La commissione conclude i propri lavori entro il 20 ottobre 2021. Ai componenti della commissione non spettano compensi, gettoni di presenza, rimborsi di spese o altri emolumenti comunque denominati. Le attivita' della commissione sono svolte senza nuovi o maggiori oneri a carico della finanza pubblica. Fino alla data indicata al primo periodo e' sospesa, con riferimento alla sola gestione sostitutiva dell'INPGI, l'efficacia delle disposizioni del comma 4 dell'articolo 2 del decreto legislativo 30 giugno 1994, n. 509. (11)
(11) Comma così modificato dall'art. 67, comma 9-quinquies, D.L. 25 maggio 2021, n. 73, convertito, con modificazioni, dalla L. 23 luglio 2021, n. 106.",
"32. L'INPGI, a sostegno dell'efficacia degli interventi di cui al comma 29, nell'ambito dell'autonomia organizzativa, gestionale e contabile prevista dal decreto legislativo 30 giugno 1994, n. 509, adotta le ulteriori misure necessarie per il riequilibrio della gestione sostitutiva dell'assicurazione generale obbligatoria da sottoporre alla vigilanza statale ai sensi del medesimo decreto legislativo.",
"33. All'articolo 1, comma 503, della legge 27 dicembre 2019, n. 160, le parole: «e il 31 dicembre 2020» sono sostituite dalle seguenti: «e il 31 dicembre 2021».",
"34. Al fine di garantire la sostenibilità della riforma del lavoro sportivo, è istituito nello stato di previsione del Ministero dell'economia e delle finanze un apposito fondo, con dotazione di 50 milioni di euro per l'anno 2021 e di 50 milioni di euro per l'anno 2022, per finanziare nei predetti limiti l'esonero, anche parziale, dal versamento dei contribuiti previdenziali a carico delle federazioni sportive nazionali, discipline sportive associate, enti di promozione sportiva, associazioni e società sportive dilettantistiche, con esclusione dei premi e dei contributi dovuti all'Istituto nazionale per l'assicurazione contro gli infortuni sul lavoro (INAIL), relativamente ai rapporti di lavoro sportivo instaurati con atleti, allenatori, istruttori, direttori tecnici, direttori sportivi, preparatori atletici e direttori di gara. (12)
(12) Per la rideterminazione dell'autorizzazione di spesa di cui al presente comma vedi l'art. 39, comma 7, D.L. 31 maggio 2021, n. 77, convertito, con modificazioni, dalla L. 29 luglio 2021, n. 108, e, successivamente, l'art. 46, comma 1, D.L. 6 novembre 2021, n. 152.",
"35. L'esonero di cui al comma 34 è cumulabile con altri esoneri o riduzioni delle aliquote di finanziamento previsti dalla normativa vigente, nei limiti della contribuzione previdenziale dovuta.",
"36. Per le federazioni sportive nazionali, gli enti di promozione sportiva e le associazioni e società sportive professionistiche e dilettantistiche che hanno il domicilio fiscale, la sede legale o la sede operativa nel territorio dello Stato e operano nell'ambito di competizioni sportive in corso di svolgimento ai sensi del decreto del Presidente del Consiglio dei ministri 24 ottobre 2020, sono sospesi:
a) i termini relativi ai versamenti delle ritenute alla fonte, di cui agli articoli 23 e 24 del decreto del Presidente della Repubblica 29 settembre 1973, n. 600, che i predetti soggetti operano in qualita' di sostituti d'imposta, dal 1° gennaio 2021 al 28 febbraio 2021;
b) i termini relativi agli adempimenti e ai versamenti dei contributi previdenziali e assistenziali e dei premi per l'assicurazione obbligatoria, dal 1° gennaio 2021 al 28 febbraio 2021;
c) i termini dei versamenti relativi all'imposta sul valore aggiunto in scadenza nei mesi di gennaio e febbraio 2021;
d) i termini relativi ai versamenti delle imposte sui redditi in scadenza dal 1° gennaio 2021 al 28 febbraio 2021.",
"37. I versamenti sospesi ai sensi del comma 36 sono effettuati, senza applicazione di sanzioni e interessi, in un'unica soluzione entro il 30 maggio 2021 o mediante rateizzazione fino a un massimo di ventiquattro rate mensili di pari importo, con il versamento della prima rata entro il 30 maggio 2021. I versamenti relativi ai mesi di dicembre degli anni 2021 e 2022 devono essere effettuati entro il giorno 16 di detti mesi. Non si fa luogo al rimborso di quanto già versato.",
"38. All'articolo 1, comma 44, della legge 11 dicembre 2016, n. 232, sono apportate le seguenti modificazioni:
a) al primo periodo, le parole: «2019 e 2020» sono sostituite dalle seguenti: «2019, 2020 e 2021»;
b) il secondo periodo è soppresso.",
