"271. Gli importi del trattamento di fine rapporto richiesti dai lavoratori e destinati alla sottoscrizione di capitale sociale delle cooperative costituite ai sensi dell'articolo 23, comma 3-quater, del decreto-legge 22 giugno 2012, n. 83, convertito, con modificazioni, dalla legge 7 agosto 2012, n. 134, introdotto dal comma 270 del presente articolo, non concorrono alla formazione del reddito imponibile dei lavoratori medesimi.",
"272. Le misure di favore previste dall'articolo 3, comma 4-ter, del testo unico delle disposizioni concernenti l'imposta sulle successioni e donazioni, di cui al decreto legislativo 31 ottobre 1990, n. 346, e dall'articolo 58 del testo unico delle imposte sui redditi, di cui al decreto del Presidente della Repubblica 22 dicembre 1986, n. 917, si applicano nei casi di cessione di azienda di cui all'articolo 23, comma 3-quater, del decreto-legge 22 giugno 2012, n. 83, convertito, con modificazioni, dalla legge 7 agosto 2012, n. 134, introdotto dal comma 270 del presente articolo. Il Ministro dell'economia e delle finanze stabilisce con proprio decreto, da emanare entro sessanta giorni dalla data di entrata in vigore della presente legge, i criteri e le modalità per l'accesso ai relativi benefìci.",
"273. Le cooperative di cui all'articolo 23, comma 3-quater, del decreto-legge 22 giugno 2012, n. 83, convertito, con modificazioni, dalla legge 7 agosto 2012, n. 134, introdotto dal comma 270 del presente articolo, rispettano la condizione di prevalenza di cui all'articolo 2513 del codice civile a decorrere dal quinto anno successivo alla loro costituzione.",
"274. All'articolo 43 del decreto-legge 28 settembre 2018, n. 109, convertito, con modificazioni, dalla legge 16 novembre 2018, n. 130, sono apportate le seguenti modificazioni:
a) dopo il comma 1 è inserito il seguente: 
« 1-bis. I soggetti beneficiari dei mutui agevolati di cui al decreto-legge 30 dicembre 1985, n. 786, convertito, con modificazioni, dalla legge 28 febbraio 1986, n. 44, al decreto-legge 31 gennaio 1995, n. 26, convertito, con modificazioni, dalla legge 29 marzo 1995, n. 95, al decreto-legge 1° ottobre 1996, n. 510, convertito, con modificazioni, dalla legge 28 novembre 1996, n. 608, e al decreto legislativo 21 aprile 2000, n. 185, possono beneficiare di un allungamento dei termini di restituzione fino a un massimo di 84 rate mensili. I suddetti benefìci si applicano anche nel caso in cui sia stata già adottata da Invitalia Spa la risoluzione del contratto di finanziamento agevolato in ragione della morosità nella restituzione delle rate, purché il relativo credito non risulti già iscritto a ruolo ovvero non siano stati avviati contenziosi per il recupero dello stesso; Invitalia Spa, su richiesta dei soggetti beneficiari, da presentare entro il 31 marzo 2021, procede, nel rispetto della normativa dell'Unione europea in materia di aiuti di Stato, alla ricognizione del debito, costituito dalla quota del mutuo non restituita aumentata delle spese legali nei limiti di quanto giudizialmente liquidato, tenendo conto delle somme a qualsiasi titolo versate a Invitalia Spa dai soggetti richiedenti »; 
b) il comma 2 è sostituito dal seguente: 
« 2. Nell'ambito delle soluzioni negoziali giudizialmente assistite delle crisi d'impresa ovvero nell'ambito delle attività giudiziali pendenti per il recupero dei crediti in ragione della revoca o della risoluzione del contratto di finanziamento agevolato, purché il soggetto beneficiario non abbia cessato l'attività alla data del 31 dicembre 2020, Invitalia Spa, previa acquisizione del parere favorevole dell'Avvocatura dello Stato, è obbligata ad aderire tempestivamente, e comunque non oltre trenta giorni dall'acquisizione del parere dell'Avvocatura, a proposte transattive presentate dai soggetti beneficiari o da altro soggetto interessato alla continuità aziendale, per importi pari al 25 per cento del debito in un'unica soluzione oppure pari al 100 per cento del debito in 84 rate mensili costanti; al mancato pagamento di tre rate mensili, anche non consecutive, la predetta proposta transattiva decade. Ai fini del presente articolo, per debito deve intendersi, in caso di risoluzione, la quota del mutuo non restituita, aumentata degli interessi calcolati al tasso legale vigente dal momento dell'inadempimento e dalle spese legali sostenute da Invitalia Spa fino al momento del perfezionamento dell'accordo, tenendo conto delle somme a qualsiasi titolo versate a Invitalia Spa che comunque sono imputate prima a conto interessi e poi a sorte capitale; analogamente in caso di revoca delle agevolazioni, la quale ordinariamente comporterebbe anche la restituzione dei contributi, per debito deve intendersi quanto previsto nella fattispecie della risoluzione, ovvero la sola quota del mutuo non restituita, aumentata degli interessi calcolati al tasso legale vigente dal momento dell'inadempimento e dalle spese legali sostenute da Invitalia Spa fino al momento del perfezionamento dell'accordo, tenendo conto delle somme a qualsiasi titolo versate a Invitalia Spa che comunque sono imputate prima a conto interessi e poi a sorte capitale »; 
c) dopo il comma 2-bis è aggiunto il seguente: 
« 2-ter. Invitalia Spa sospende le procedure esecutive pendenti nei confronti dei soggetti che hanno presentato domanda ai sensi del presente articolo per un periodo di dodici mesi dalla data di ricezione della domanda. Invitalia Spa deve rivolgere tempestivamente istanza all'autorità competente, in base alle norme in vigore, per la sospensione delle procedure esecutive che siano in atto a carico dei richiedenti l'adesione transattiva ai sensi del presente articolo, al fine di non arrecare pregiudizio irreversibile alla continuità aziendale ». ",
"275. Il Fondo sociale per occupazione e formazione di cui all'articolo 18, comma 1, lettera a), del decreto-legge 29 novembre 2008, n. 185, convertito, con modificazioni, dalla legge 28 gennaio 2009, n. 2, è incrementato di 600 milioni di euro per l'anno 2021 e di 200 milioni di euro per l'anno 2022.",
"276. Nello stato di previsione del Ministero del lavoro e delle politiche sociali è istituito il Fondo per il sostegno della parità salariale di genere, con una dotazione di 2 milioni di euro annui a decorrere dall'anno 2022, destinato alla copertura finanziaria, nei limiti della predetta dotazione, di interventi finalizzati al sostegno e al riconoscimento del valore sociale ed economico della parità salariale di genere e delle pari opportunità sui luoghi di lavoro.",
"277. Con decreto del Ministro del lavoro e delle politiche sociali, di concerto con il Ministro dell'economia e delle finanze, sono stabilite le modalità di attuazione del comma 276.",
"278. E' prorogato per gli anni 2021 e 2022 il trattamento di sostegno del reddito di cui all'articolo 44 del decreto-legge 28 settembre 2018, n. 109, convertito, con modificazioni, dalla legge 16 novembre 2018, n. 130, per un periodo massimo complessivo di autorizzazione del trattamento straordinario di integrazione salariale di dodici mesi e nel limite di spesa di 200 milioni di euro per l'anno 2021 e di 50 milioni di euro per l'anno 2022. Agli oneri derivanti dal primo periodo del presente comma, pari a 200 milioni di euro per l'anno 2021 e a 50 milioni di euro per l'anno 2022, si provvede a valere sul Fondo sociale per occupazione e formazione, di cui all'articolo 18, comma 1, lettera a), del decreto-legge 29 novembre 2008, n. 185, convertito, con modificazioni, dalla legge 28 gennaio 2009, n. 2. In sede di accordo governativo è verificata la sostenibilità finanziaria del trattamento straordinario di integrazione salariale e nell'accordo è indicato il relativo onere finanziario. Al fine del monitoraggio della spesa, gli accordi governativi sono trasmessi al Ministero dell'economia e delle finanze e all'INPS per il monitoraggio mensile dei flussi di spesa relativi all'erogazione delle prestazioni. Qualora dal monitoraggio emerga che è stato raggiunto o sarà raggiunto il limite di spesa, non possono essere stipulati altri accordi. (47)
(47) Per la rideterminazione delle risorse di cui al primo periodo del presente comma vedi l'art. 44, comma 1-bis, D.L. 28 settembre 2018, n. 109, convertito, con modificazioni, dalla L. 16 novembre 2018, n. 130, aggiunto dall'art. 45, comma, 1, D.L. 25 maggio 2021, n. 73, convertito, con modificazioni, dalla L. 23 luglio 2021, n. 106. ",
"279. All'articolo 93 del decreto-legge 19 maggio 2020, n. 34, convertito, con modificazioni, dalla legge 17 luglio 2020, n. 77, al comma 1, le parole: « 31 dicembre 2020 » sono sostituite dalle seguenti: « 31 marzo 2021 ».",
"280. Le misure di sostegno del reddito per i lavoratori dipendenti delle imprese del settore dei call center, di cui all'articolo 44, comma 7, del decreto legislativo 14 settembre 2015, n. 148, sono prorogate per l'anno 2021 nel limite di spesa di 20 milioni di euro. All'onere derivante dal primo periodo del presente comma, pari a 20 milioni di euro per l'anno 2021, si provvede a valere sul Fondo sociale per occupazione e formazione, di cui all'articolo 18, comma 1, lettera a), del decreto-legge 29 novembre 2008, n. 185, convertito, con modificazioni, dalla legge 28 gennaio 2009, n. 2.",
"281. All'articolo 199, comma 1, lettera b), del decreto-legge 19 maggio 2020, n. 34, convertito, con modificazioni, dalla legge 17 luglio 2020, n. 77, dopo le parole: « nel limite massimo di 4 milioni di euro per l'anno 2020 » sono inserite le seguenti: « e di 2 milioni di euro per l'anno 2021 ».",
"282. A valere sul Fondo sociale per occupazione e formazione, di cui all'articolo 18, comma 1, lettera a), del decreto-legge 29 novembre 2008, n. 185, convertito, con modificazioni, dalla legge 28 gennaio 2009, n. 2, si provvede, nella misura di 12 milioni di euro per l'anno 2021, al finanziamento dell'indennità onnicomprensiva, pari a trenta euro giornalieri per l'anno 2021, per ciascun lavoratore dipendente da impresa adibita alla pesca marittima, compresi i soci lavoratori delle cooperative della piccola pesca, di cui alla legge 13 marzo 1958, n. 250, in caso di sospensione dal lavoro derivante da misure di arresto temporaneo obbligatorio.",
"283. A valere sul Fondo sociale per occupazione e formazione, di cui all'articolo 18, comma 1, lettera a), del decreto-legge 29 novembre 2008, n. 185, convertito, con modificazioni, dalla legge 28 gennaio 2009, n. 2, si provvede, nella misura di 7 milioni di euro per l'anno 2021, al finanziamento dell'indennità onnicomprensiva, pari a trenta euro giornalieri per l'anno 2021, per ciascun lavoratore dipendente da impresa adibita alla pesca marittima, compresi i soci lavoratori delle cooperative della piccola pesca, di cui alla legge 13 marzo 1958, n. 250, in caso di sospensione dal lavoro derivante da misure di arresto temporaneo non obbligatorio.",
"284. Il trattamento di cui all'articolo 1, comma 1, del decreto legislativo 18 maggio 2018, n. 72, è prorogato per gli anni 2021, 2022 e 2023, alle medesime condizioni stabilite dal medesimo articolo 1, comma 1, per una durata massima complessiva di dodici mesi nel triennio e nel limite di spesa di 1 milione di euro per ciascuno dei tre anni. All'onere derivante dal primo periodo del presente comma, pari a 1 milione di euro per ciascuno degli anni 2021, 2022 e 2023, si provvede a valere sul Fondo sociale per occupazione e formazione, di cui all'articolo 18, comma 1, lettera a), del decreto-legge 29 novembre 2008, n. 185, convertito, con modificazioni, dalla legge 28 gennaio 2009, n. 2.",
"285. L'efficacia delle disposizioni di cui all'articolo 22-bis del decreto legislativo 14 settembre 2015, n. 148, è prorogata per gli anni 2021 e 2022, nel limite di 130 milioni di euro per l'anno 2021 e di 100 milioni di euro per l'anno 2022. Agli oneri derivanti dal primo periodo del presente comma, pari a 130 milioni per l'anno 2021 e a 100 milioni di euro per l'anno 2022, si provvede a valere sul Fondo sociale per occupazione e formazione, di cui all'articolo 18, comma 1, lettera a), del decreto-legge 29 novembre 2008, n. 185, convertito, con modificazioni, dalla legge 28 gennaio 2009, n. 2.",
"286. Al fine dell'attuazione dei piani di nuova industrializzazione, di recupero o di tenuta occupazionale relativi a crisi aziendali incardinate presso le unità di crisi del Ministero dello sviluppo economico o delle regioni, le regioni e le province autonome di Trento e di Bolzano possono concedere nell'anno 2021 ulteriori periodi di trattamento di integrazione salariale in deroga nel limite della durata massima di dodici mesi, anche non continuativi.",
"287. All'onere derivante dall'attuazione del comma 286 si fa fronte nel limite massimo delle risorse già assegnate alle regioni e alle province autonome di Trento e di Bolzano ai sensi dell'articolo 44, comma 6-bis, del decreto legislativo 14 settembre 2015, n. 148, ove non previamente utilizzate ai sensi del comma 3 dell'articolo 26-ter del decreto-legge 28 gennaio 2019, n. 4, convertito, con modificazioni, dalla legge 28 marzo 2019, n. 26, e ai sensi dell'articolo 22, commi 8-quater e 8-quinquies, del decreto-legge 17 marzo 2020, n. 18, convertito, con modificazioni, dalla legge 24 aprile 2020, n. 27, e comunque nel limite massimo di 10 milioni di euro per l'anno 2021. Le regioni e le province autonome di Trento e di Bolzano concedono l'indennità di cui al comma 286 del presente articolo, esclusivamente previa verifica della disponibilità finanziaria da parte dell'Istituto nazionale della previdenza sociale.",
"288. Le regioni e le province autonome di Trento e di Bolzano assicurano ai lavoratori beneficiari dei trattamenti di integrazione salariale in deroga di cui al comma 286 l'applicazione di misure di politica attiva, individuate, a valere sulle risorse proprie e senza nuovi o maggiori oneri a carico della finanza pubblica, in accordo con le organizzazioni sindacali maggiormente rappresentative, in un apposito piano regionale, da comunicare al Ministero del lavoro e delle politiche sociali e all'Agenzia nazionale per le politiche attive del lavoro.",
"289. Al fine del completamento dei piani di recupero occupazionale di cui all'articolo 44, comma 11-bis, del decreto legislativo 14 settembre 2015, n. 148, sono stanziate ulteriori risorse per un importo pari a 180 milioni di euro, a valere sul Fondo sociale per occupazione e formazione, di cui all'articolo 18, comma 1, lettera a), del decreto-legge 29 novembre 2008, n. 185, convertito, con modificazioni, dalla legge 28 gennaio 2009, n. 2, da ripartire tra le regioni con decreto del Ministro del lavoro e delle politiche sociali, di concerto con il Ministro dell'economia e delle finanze. Le predette regioni possono destinare, nell'anno 2021, le risorse stanziate ai sensi del primo periodo alle medesime finalità del citato articolo 44, comma 11-bis, del decreto legislativo n. 148 del 2015, nonché a quelle dell'articolo 53-ter del decreto-legge 24 aprile 2017, n. 50, convertito, con modificazioni, dalla legge 21 giugno 2017, n. 96.",
"290. Al fine di assicurare la prosecuzione degli interventi di cassa integrazione guadagni straordinaria e di mobilità in deroga nelle aree di crisi industriale complessa individuate dalle regioni per l'anno 2020 e non autorizzate per mancanza di copertura finanziaria, è istituito, nello stato di previsione del Ministero del lavoro e delle politiche sociali, un Fondo per il sostegno al reddito dei lavoratori delle aree di crisi industriale complessa con una dotazione di 10 milioni di euro per l'anno 2021. Con decreto del Ministro del lavoro e delle politiche sociali, di concerto con il Ministro dell'economia e delle finanze, da adottare entro trenta giorni dalla data di entrata in vigore della presente legge, sono stabiliti i criteri e le modalità di riparto tra le regioni delle risorse di cui al predetto Fondo sulla base dei fabbisogni comunicati anche al fine del rispetto del limite di spesa previsto dal presente comma. (48)
(48) In attuazione di quanto disposto dal presente comma vedi il D.M. 26 marzo 2021, n. 17. ",
"291. All'articolo 1-ter del decreto-legge 14 agosto 2020, n. 104, convertito, con modificazioni, dalla legge 13 ottobre 2020, n. 126, sono apportate le seguenti modificazioni:
a) al comma 1: 
1) dopo la parola: « decreto » sono inserite le seguenti: « , nelle more di una riforma organica degli ammortizzatori sociali, volta a fare fronte ai vuoti normativi che di fatto pregiudicano la tutela, il sostegno al reddito e le politiche di reinserimento nel mercato del lavoro di una considerevole platea di soggetti, »; 
2) le parole: « delle aree di crisi complessa » sono soppresse; 
3) le parole: « 31 dicembre 2020 » sono sostituite dalle seguenti: « 31 dicembre 2021 »; 
4) le parole: « , nel limite massimo di 2,43 milioni di euro per l'anno 2020 » sono soppresse; 
b) al comma 2: 
1) all'alinea, dopo la parola: « presenza » sono inserite le seguenti: « alla data di presentazione dell'istanza »; 
2) dopo la lettera d) è aggiunta la seguente: 
« d-bis) aver percepito o essere percettori dell'indennità di disoccupazione denominata Nuova prestazione di Assicurazione Sociale per l'Impiego (NASpI) »; 
c) dopo il comma 3 è aggiunto il seguente: 
« 3-bis. Ai lavoratori di cui al comma 1, dal 1° gennaio 2021, sono applicate misure di politica attiva, individuate in un apposito piano regionale, da comunicare al Ministero del lavoro e delle politiche sociali e all'Agenzia nazionale per le politiche attive del lavoro (ANPAL) »; 
d) la rubrica è sostituita dalla seguente: « Indennità per i lavoratori della regione Campania ». ",
"292. Nell'anno 2021, in deroga a quanto previsto dall'articolo 1, commi 446 e 447, della legge 30 dicembre 2018, n. 145, le amministrazioni pubbliche utilizzatrici dei lavoratori socialmente utili di cui all'articolo 2, comma 1, del decreto legislativo 28 febbraio 2000, n. 81, e all'articolo 3, comma 1, del decreto legislativo 7 agosto 1997, n. 280, nonché dei lavoratori già rientranti nell'abrogato articolo 7 del decreto legislativo 1° dicembre 1997, n. 468, e dei lavoratori impegnati in attività di pubblica utilità, anche mediante contratti di lavoro a tempo determinato o contratti di collaborazione coordinata e continuativa nonché mediante altre tipologie contrattuali, possono assumere a tempo indeterminato i suddetti lavoratori da inquadrare nei profili professionali delle aree o categorie per i quali non è richiesto il titolo di studio superiore a quello della scuola dell'obbligo che abbiano la professionalità richiesta, in relazione all'esperienza effettivamente maturata, e i requisiti previsti per l'accesso al pubblico impiego, nel rispetto delle seguenti condizioni e modalità:
a) possesso da parte dei lavoratori dei requisiti di anzianità previsti dall'articolo 4, comma 6, del decreto-legge 31 agosto 2013, n. 101, convertito, con modificazioni, dalla legge 30 ottobre 2013, n. 125, ovvero dall'articolo 20, commi 1 e 2, del decreto legislativo 25 maggio 2017, n. 75, o svolgimento delle attività socialmente utili o di pubblica utilità per il medesimo periodo di tempo; 
b) assunzione secondo le modalità previste dall'articolo 20, comma 1, del decreto legislativo 25 maggio 2017, n. 75, dei lavoratori che siano stati previamente individuati, in relazione alle medesime attività svolte, con procedure selettive pubbliche anche espletate presso amministrazioni diverse da quella che procede all'assunzione, salvo quanto previsto dalle lettere a), c) e d) del presente comma; 
c) espletamento di selezioni riservate, mediante prova di idoneità, ai lavoratori che non siano stati previamente individuati, in relazione alle medesime attività svolte, con procedure selettive pubbliche anche espletate presso amministrazioni diverse da quella che procede all'assunzione, salvo quanto previsto dalle lettere a), b) e d) del presente comma; 
d) assunzione secondo le modalità previste dall'articolo 20, commi 1 e 2, del decreto legislativo 25 maggio 2017, n. 75, dei lavoratori utilizzati mediante contratti di lavoro a tempo determinato o contratti di collaborazione coordinata e continuativa nonché mediante altre tipologie contrattuali, fermo restando quanto disposto dalle lettere a), b) e c) del presente comma.",
"293. Le assunzioni a tempo indeterminato di cui al comma 292 del presente articolo, anche con contratti di lavoro a tempo parziale, sono consentite nei limiti della dotazione organica e del piano di fabbisogno del personale e sono considerate, ai sensi dell'articolo 36, comma 2, del decreto legislativo 30 marzo 2001, n. 165, nella quota di accesso dall'esterno. Resta fermo quanto previsto dall'articolo 1, comma 446, lettere d), e), f), g) e h) della legge 30 dicembre 2018, n. 145.",
"294. All'articolo 1, comma 162, della legge 27 dicembre 2019, n. 160, le parole: « 31 dicembre 2020 » sono sostituite dalle seguenti: « 31 dicembre 2021 ».",
"295. All'articolo 1, comma 495, della legge 27 dicembre 2019, n. 160, le parole: « per il solo anno 2020 » sono sostituite dalle seguenti: « fino al 31 marzo 2021 ».",
"296. All'articolo 1, comma 495, della legge 27 dicembre 2019, n. 160, è aggiunto, in fine, il seguente periodo: « I lavoratori che alla data del 31 dicembre 2016 erano impiegati in progetti di lavori socialmente utili ai sensi degli articoli 4, commi 6 e 21, e 9, comma 25, lettera b), del decreto-legge 1° ottobre 1996, n. 510, convertito, con modificazioni, dalla legge 28 novembre 1996, n. 608, possono essere assunti dalle pubbliche amministrazioni che ne erano utilizzatrici alla predetta data, a tempo indeterminato, anche con contratti di lavoro a tempo parziale, anche in deroga, per il solo anno 2021 in qualità di lavoratori sovrannumerari, alla dotazione organica e al piano di fabbisogno del personale previsti dalla vigente normativa limitatamente alle risorse di cui al primo periodo del comma 497 del presente articolo ».",
"297. Per gli esercizi finanziari 2021 e 2022, le risorse di cui all'articolo 1, comma 110, lettera b), della legge 27 dicembre 2017, n. 205, sono incrementate di 55 milioni di euro per l'anno 2021 e di 50 milioni di euro per l'anno 2022, di cui 50 milioni di euro per ciascuno dei medesimi anni a valere sulle risorse del Fondo sociale per occupazione e formazione, di cui all'articolo 18, comma 1, lettera a), del decreto-legge 29 novembre 2008, n. 185, convertito, con modificazioni, dalla legge 28 gennaio 2009, n. 2.",
"298. Al fine di promuovere e valorizzare il sistema di istruzione e formazione tecnica superiore, il Fondo per l'istruzione e formazione tecnica superiore, di cui all'articolo 1, comma 875, della legge 27 dicembre 2006, n. 296, come incrementato dall'articolo 1, comma 67, della legge 27 dicembre 2017, n. 205, è ulteriormente incrementato di 20 milioni di euro per l'anno 2021.",
"299. Al fine di garantire, qualora necessario per il prolungarsi degli effetti sul piano occupazionale dell'emergenza epidemiologica da COVID-19, la possibilità di una più ampia forma di tutela delle posizioni lavorative per l'anno 2021 mediante trattamenti di cassa integrazione ordinaria, assegno ordinario e cassa integrazione in deroga, è istituito, nell'ambito dello stato di previsione del Ministero del lavoro e delle politiche sociali, un apposito fondo con una dotazione di 6.128,3 milioni di euro per l'anno 2021. L'importo di 2.298,3 milioni di euro per l'anno 2021, relativo alle autorizzazioni di spesa di cui all'articolo 19, comma 9, del decreto-legge 17 marzo 2020, n. 18, convertito, con modificazioni, dalla legge 24 aprile 2020, n. 27, e all'articolo 1, comma 11, del decreto-legge 14 agosto 2020, n. 104, convertito, con modificazioni, dalla legge 13 ottobre 2020, n. 126, conservato in conto residui ai sensi dell'ultimo periodo del comma 9 dell'articolo 265 del decreto-legge 19 maggio 2020, n. 34, convertito, con modificazioni, dalla legge 17 luglio 2020, n. 77, è versato all'entrata del bilancio dello Stato nell'anno 2021 e resta acquisito all'erario. (49)
(49) Comma così modificato dall'art. 7, comma 2, lett. a), D.L. 22 marzo 2021, n. 41, convertito, con modificazioni, dalla L. 21 maggio 2021, n. 69. ",
"300. I datori di lavoro che sospendono o riducono l'attività lavorativa per eventi riconducibili all'emergenza epidemiologica da COVID-19 possono presentare domanda di concessione del trattamento ordinario di integrazione salariale, dell'assegno ordinario e del trattamento di integrazione salariale in deroga, di cui agli articoli da 19 a 22-quinquies del decreto-legge 17 marzo 2020, n. 18, convertito, con modificazioni, dalla legge 24 aprile 2020, n. 27, per una durata massima di dodici settimane. Le dodici settimane devono essere collocate nel periodo compreso tra il 1° gennaio 2021 e il 31 marzo 2021 per i trattamenti di cassa integrazione ordinaria, e nel periodo compreso tra il 1° gennaio 2021 e il 30 giugno 2021 per i trattamenti di assegno ordinario e di cassa integrazione salariale in deroga. Con riferimento a tali periodi, le predette dodici settimane costituiscono la durata massima che può essere richiesta con causale COVID-19. I periodi di integrazione salariale precedentemente richiesti e autorizzati ai sensi dell'articolo 12 del decreto-legge 28 ottobre 2020, n. 137, convertito, con modificazioni, dalla legge 18 dicembre 2020, n. 176, collocati, anche parzialmente, in periodi successivi al 1° gennaio 2021 sono imputati, ove autorizzati, alle dodici settimane del presente comma.",
