"861. Al fine di far fronte alle rilevanti scoperture di organico, il Ministero della giustizia, per le esigenze del Dipartimento dell'amministrazione penitenziaria, è autorizzato, per l'anno 2021, in aggiunta alle vigenti facoltà assunzionali, a bandire procedure concorsuali pubbliche e, conseguentemente, ad assumere con contratti di lavoro a tempo indeterminato, nei limiti della vigente dotazione organica, un contingente di 200 unità di personale del comparto funzioni centrali, di cui 70 unità da inquadrare nell'Area III, posizione economica F1, 10 unità nell'Area II, posizione economica F3, e 120 unità nell'Area II, posizione economica F2.",
862. Per lo svolgimento delle procedure concorsuali di cui al comma 861 è autorizzata la spesa di euro 1.000.000 per l'anno 2021.,
"863. Per l'attuazione delle disposizioni di cui al comma 861, è autorizzata la spesa di euro 2.115.962 per l'anno 2021 e di euro 8.463.845 annui a decorrere dall'anno 2022, cui si provvede mediante utilizzo delle risorse del fondo di cui al comma 854.",
"864. Per il compiuto svolgimento delle specifiche attribuzioni demandate all'amministrazione penitenziaria, la vigente dotazione organica del Ministero della giustizia - Dipartimento dell'amministrazione penitenziaria è aumentata di 100 unità di personale appartenente all'Area III.",
"865. Per le medesime finalità di cui al comma 864, il Ministero della giustizia, in aggiunta alle vigenti facoltà assunzionali, è autorizzato, nel triennio 2021-2023, a bandire procedure concorsuali pubbliche e ad assumere con contratto di lavoro subordinato a tempo indeterminato un contingente di personale pari a 100 unità da inquadrare nell'Area III, fascia retributiva F1, del comparto Funzioni centrali.",
866. Per l'attuazione delle disposizioni di cui ai commi 864 e 865 è autorizzata la spesa di 1.167.216 euro per l'anno 2021 e di 4.668.861 euro annui a decorrere dall'anno 2022. Per lo svolgimento delle procedure concorsuali è autorizzata la spesa di 1.000.000 di euro per l'anno 2021.,
"867. Al fine di rafforzare l'offerta trattamentale legata all'esecuzione penale esterna e di comunità e alla luce delle rilevanti scoperture di organico, il Ministero della giustizia, per le esigenze del Dipartimento per la giustizia minorile e di comunità, è autorizzato, per l'anno 2021, in aggiunta alle vigenti facoltà assunzionali, a bandire procedure concorsuali pubbliche e, conseguentemente, ad assumere con contratti di lavoro a tempo indeterminato, nei limiti della vigente dotazione organica, un contingente di 80 unità di personale del comparto funzioni centrali, di cui 35 unità da inquadrare nell'Area III, posizione economica F1, e 45 unità nell'Area II, posizione economica F2.",
"868. Al fine di incentivare le attività amministrative del personale del settore della giustizia, nonché di garantire maggiore efficienza e funzionalità agli uffici giudiziari, agli istituti penitenziari per adulti e minori e ai servizi di giustizia minorile e di esecuzione penale esterna, in particolare nella fase connessa al superamento dell'emergenza epidemiologica da COVID-19, il Fondo risorse decentrate del personale contrattualizzato non dirigente è incrementato di 6 milioni di euro per l'anno 2021, di 8,4 milioni di euro per l'anno 2022 e di 10 milioni di euro a decorrere dall'anno 2023.",
"869. Quota parte delle risorse di cui al comma 959, nella misura corrispondente all'onere per la copertura a regime dell'elemento perequativo di cui all'articolo 1, comma 440, lettera b), della legge 30 dicembre 2018, n. 145, è destinata, per la predetta finalità, alla contrattazione collettiva nazionale del personale contrattualizzato delle amministrazioni statali. Per il personale contrattualizzato del settore non statale, per la medesima finalità, si provvede ai sensi dell'articolo 1, comma 438, della citata legge n. 145 del 2018.",
"870. In considerazione del periodo di emergenza epidemiologica da COVID-19, le risorse destinate, nel rispetto dell'articolo 23, comma 2, del decreto legislativo 25 maggio 2017, n. 75, a remunerare le prestazioni di lavoro straordinario del personale civile delle amministrazioni di cui all'articolo 1, comma 2, del decreto legislativo 30 marzo 2001, n. 165, non utilizzate nel corso del 2020, nonché i risparmi derivanti dai buoni pasto non erogati nel medesimo esercizio, previa certificazione da parte dei competenti organi di controllo, possono finanziare nell'anno successivo, nell'ambito della contrattazione integrativa, in deroga al citato articolo 23, comma 2, i trattamenti economici accessori correlati alla performance e alle condizioni di lavoro, ovvero agli istituti del welfare integrativo. Per i Ministeri le predette somme sono conservate nel conto dei residui per essere versate all'entrata del bilancio dello Stato e riassegnate ai pertinenti capitoli di spesa. Agli oneri derivanti dal presente comma, pari a 44,53 milioni di euro per l'anno 2021, si provvede mediante corrispondente riduzione del Fondo per la compensazione degli effetti finanziari non previsti a legislazione vigente conseguenti all'attualizzazione di contributi pluriennali, di cui all'articolo 6, comma 2, del decreto-legge 7 ottobre 2008, n. 154, convertito, con modificazioni, dalla legge 4 dicembre 2008, n. 189.",
871. Per lo svolgimento delle procedure concorsuali di cui al comma 867 è autorizzata la spesa di euro 1.000.000 per l'anno 2021.,
"872. Per l'attuazione delle disposizioni di cui al comma 867, è autorizzata la spesa di euro 855.648 per l'anno 2021 e di euro 3.422.590 annui a decorrere dall'anno 2022, cui si provvede mediante utilizzo delle risorse del fondo di cui al comma 854.",
"873. Al fine di assicurare i necessari standard di funzionalità dell'amministrazione e delle relative strutture interne, anche in relazione ai peculiari compiti in materia di politiche di tutela, coordinamento e programmazione dei settori agroalimentare, dell'ippica, della pesca e forestale, nonché per adeguare tempestivamente i livelli dei servizi alle nuove esigenze anche a seguito degli effetti derivanti dall'emergenza da COVID-19, e far fronte, conseguentemente, alla necessità di coprire le vacanze di organico, il Ministero delle politiche agricole alimentari e forestali, per il biennio 2021-2022, è autorizzato a bandire procedure concorsuali pubbliche, secondo i princìpi e i criteri direttivi di cui agli articoli 247, 248 e 249 del decreto-legge 19 maggio 2020, n. 34, convertito, con modificazioni, dalla legge 17 luglio 2020, n. 77, e conseguentemente ad assumere, con contratto di lavoro a tempo indeterminato, in aggiunta alle vigenti facoltà assunzionali e nei limiti della vigente dotazione organica, un contingente di 140 unità di personale, di cui 58 unità da inquadrare nell'Area III, posizione economica F1, e 28 unità nell'Area II, posizione economica F2, da assumere nell'anno 2021 e 30 unità da inquadrare nell'Area III, posizione economica F1, 21 unità nell'Area II, posizione economica F2, e 3 unità di personale dirigenziale di seconda fascia da assumere nell'anno 2022.",
"874. Nell'ambito dell'autorizzazione all'assunzione di cui al comma 873 possono essere avviate anche nuove procedure concorsuali per il reclutamento di professionalità con competenze in materia di:
a) digitalizzazione;
b) razionalizzazione e semplificazione dei processi e dei procedimenti amministrativi;
c) qualità dei servizi pubblici;
d) gestione dei fondi strutturali e della capacità di investimento;
e) contrattualistica pubblica;
f) controllo di gestione e attività ispettiva;
g) tecnica di redazione degli atti normativi e analisi e verifica di impatto della regolamentazione;
h) monitoraggio degli andamenti di finanza pubblica e di bilancio.
",
875. Per lo svolgimento delle procedure concorsuali pubbliche di cui al comma 873 è autorizzata la spesa di euro 100.000 per l'anno 2021.,
"876. Agli oneri derivanti dalle assunzioni di cui al comma 873, pari a 967.722 euro per l'anno 2021 e a 6.592.412 euro annui a decorrere dall'anno 2022, si provvede mediante utilizzo delle risorse del fondo di cui al comma 854.",
"877. Al fine di incrementare i servizi di soccorso pubblico, di prevenzione degli incendi e di lotta attiva agli incendi boschivi, è autorizzata l'assunzione straordinaria di un contingente massimo di 750 unità del Corpo nazionale dei vigili del fuoco, nel limite della dotazione organica, in aggiunta alle facoltà assunzionali previste a legislazione vigente, nel ruolo iniziale di vigile del fuoco, per un numero massimo di 250 unità non prima del 1° ottobre 2021, di 250 unità non prima del 1° ottobre 2022 e di 250 unità non prima del 1° ottobre 2023.",
"878. Ai fini dell'attuazione del comma 877 è autorizzata la spesa di euro 2.558.412 per l'anno 2021, di euro 13.104.943 per l'anno 2022, di euro 23.755.767 per l'anno 2023, di euro 31.848.179 per l'anno 2024, di euro 32.038.478 per l'anno 2025, di euro 32.382.499 per l'anno 2026, di euro 32.726.520 per l'anno 2027, di euro 32.984.535 per l'anno 2028, di euro 33.064.890 per l'anno 2029, di euro 33.386.308 per l'anno 2030, di euro 33.707.727 per l'anno 2031, di euro 33.948.790 per l'anno 2032 e di euro 34.087.694 annui a decorrere dall'anno 2033, cui si provvede mediante utilizzo delle risorse del fondo di cui al comma 854.",
"879. Per le spese di funzionamento connesse alle assunzioni straordinarie di cui al comma 877, comprese le spese per mense e buoni pasto, è autorizzata la spesa di euro 75.000 per l'anno 2021, di euro 300.000 per l'anno 2022, di euro 525.000 per l'anno 2023 e di euro 675.000 annui a decorrere dall'anno 2024.",
"880. Al fine di favorire il ricambio generazionale e per far fronte alle accresciute attività nei diversi settori di competenza istituzionale, e in particolare a quelle relative al settore della depenalizzazione, il Ministero dell'interno è autorizzato, per l'anno 2021, in aggiunta alle facoltà assunzionali previste a legislazione vigente, anche in deroga alle procedure di mobilità previste dagli articoli 30 e 34-bis del decreto legislativo 30 marzo 2001, n. 165, a bandire procedure concorsuali pubbliche e, conseguentemente, ad assumere con contratto di lavoro a tempo indeterminato, non prima del 1° dicembre 2021, un contingente di 250 unità di personale di livello non dirigenziale dell'amministrazione civile dell'interno da inquadrare nell'Area II, posizione economica F2, nei limiti della vigente dotazione organica.",
"881. Per far fronte agli oneri derivanti dall'attuazione del comma 880 è autorizzata la spesa di euro 778.073 per l'anno 2021 e di euro 9.336.880 annui a decorrere dall'anno 2022, cui si provvede mediante utilizzo delle risorse del fondo di cui al comma 854.",
"882. Per far fronte agli accresciuti compiti di profilassi internazionale e alle attività connesse alla competitività del sistema Paese in materia di controlli sanitari e procedure autorizzatorie, il Ministero della salute, in aggiunta alle facoltà assunzionali previste a legislazione vigente, è autorizzato, per l'anno 2021, ad assumere con contratto di lavoro a tempo indeterminato, mediante utilizzo delle graduatorie concorsuali in vigore presso il Ministero stesso ovvero mediante appositi concorsi pubblici per esami, 45 dirigenti di livello non generale, di cui 11 medici, 4 veterinari e 10 psicologi, da imputare all'aliquota dei dirigenti sanitari, 2 dirigenti con profilo economico sanitario, 10 dirigenti con profilo giuridico sanitario, 1 dirigente ingegnere biomedico, 1 dirigente informatico, 2 dirigenti ingegneri gestionali, 2 dirigenti ingegneri industriali e 2 dirigenti ingegneri ambientali, da imputare all'aliquota dei dirigenti non sanitari, nonché complessive 135 unità di personale non dirigenziale con professionalità anche tecniche, appartenenti all'Area III, posizione economica F1, del comparto funzioni centrali. La dotazione organica del Ministero della salute è incrementata di 7 unità dirigenziali non generali e di 135 unità di personale non dirigenziale appartenenti all'Area III.",
"883. Agli oneri derivanti dall'applicazione del comma 882, pari a euro 3.329.688 per l'anno 2021 e a euro 13.318.749 annui a decorrere dall'anno 2022, si provvede mediante utilizzo delle risorse del fondo di cui al comma 854.",
"884. Al fine di potenziare e accelerare le attività e i servizi svolti dalle ragionerie territoriali dello Stato nel territorio nazionale nei confronti degli uffici periferici delle amministrazioni statali, delle altre amministrazioni pubbliche interessate e dei cittadini, nonché di incrementare il livello di efficienza degli uffici e delle strutture della giustizia tributaria, tenuto anche conto del contenzioso tributario instaurato avverso i provvedimenti adottati dagli uffici territoriali dell'amministrazione finanziaria, nonché per potenziare le connesse funzioni di supporto e coordinamento delle attività svolte dalle articolazioni territoriali, anche in materia di sicurezza, il Ministero dell'economia e delle finanze è autorizzato, per l'anno 2021, a bandire procedure concorsuali, anche in deroga a quanto previsto dall'articolo 4, comma 3-quinquies, del decreto-legge 31 agosto 2013, n. 101, convertito, con modificazioni, dalla legge 30 ottobre 2013, n. 125, e, conseguentemente, ad assumere con contratto di lavoro a tempo indeterminato, nei limiti dell'attuale dotazione organica, un contingente complessivo di personale non dirigenziale pari a 550 unità, di cui 350 unità da inquadrare nell'Area III, posizione economica F1, e 100 unità nell'Area II, posizione economica F2, da destinare alle ragionerie territoriali dello Stato e 100 unità di Area III, posizione economica F1, di cui 60 da destinare alle commissioni tributarie e 40 da destinare al Dipartimento dell'amministrazione generale del personale e dei servizi, in deroga ai vigenti vincoli in materia di reclutamento di personale nelle pubbliche amministrazioni, ferma restando la possibilità di avvalersi della Commissione per l'attuazione del progetto di riqualificazione delle pubbliche amministrazioni, di cui all'articolo 35, comma 5, del decreto legislativo 30 marzo 2001, n. 165. Per le medesime finalità di cui al presente comma, alla lettera c) del comma 350 dell'articolo 1 della legge 30 dicembre 2018, n. 145, le parole: 'l'unificazione e la rideterminazione degli uffici dirigenziali non generali presso le articolazioni periferiche, apportando una riduzione del numero complessivo di uffici del Ministero non inferiore al 5 per cento.' sono soppresse. (155) (155) Comma così modificato dall'art. 1-bis, comma 7, lett. b), D.L. 31 dicembre 2020, n. 183, convertito, con modificazioni, dalla L. 26 febbraio 2021, n. 21.",
"885. Per gli oneri derivanti dalle assunzioni di cui al comma 884 è autorizzata la spesa di euro 5.888.113 per l'anno 2021 e di euro 23.552.453 annui a decorrere dall'anno 2022, cui si provvede mediante utilizzo delle risorse del fondo di cui al comma 854.",
"886. Per le finalità di cui ai commi da 1037 a 1050, al fine di avviare tempestivamente le procedure di monitoraggio degli interventi del Piano nazionale di ripresa e resilienza, il Ministero dell'economia e delle finanze, per l'anno 2021, è autorizzato ad assumere con contratto di lavoro subordinato a tempo indeterminato, in aggiunta alle vigenti facoltà assunzionali e nei limiti della vigente dotazione organica, un contingente di personale non dirigenziale di alta professionalità pari a 30 unità, da inquadrare nell'Area III, posizione economica F3. Il reclutamento del suddetto contingente di personale è effettuato, senza il previo svolgimento delle previste procedure di mobilità, mediante scorrimento di vigenti graduatorie di concorsi pubblici o attraverso l'avvio di procedure concorsuali pubbliche, per titoli ed esame orale, per l'accesso alle quali è richiesto, oltre al titolo di studio previsto per il profilo professionale di inquadramento e alla conoscenza della lingua inglese, anche il possesso di almeno uno dei seguenti requisiti pertinenti ai profili professionali richiesti: a) dottorato di ricerca in materie giuridiche o economiche, in diritto europeo e internazionale, in materia di contabilità e bilancio, o in materia statistica, in metodi quantitativi per l'economia, in analisi dei dati e in analisi delle politiche pubbliche; b) master universitario di secondo livello in materie giuridiche ed economiche concernenti il diritto europeo e internazionale, in materie inerenti alla contabilità e al bilancio, anche ai fini dello sviluppo e della sperimentazione dei relativi sistemi informativi, o in materia statistica, in metodi quantitativi per l'economia, in analisi dei dati e in analisi delle politiche pubbliche. Per le finalità di cui al presente comma è autorizzata la spesa di 1.198.406 euro per l'anno 2021 e di 1.438.087 euro annui a decorrere dall'anno 2022, cui si provvede mediante utilizzo delle risorse del fondo di cui al comma 854. (156) (156) Comma così sostituito dall'art. 1-bis, comma 7, lett. c), D.L. 31 dicembre 2020, n. 183, convertito, con modificazioni, dalla L. 26 febbraio 2021, n. 21.",
"887. All'articolo 22-bis, comma 2, del decreto-legge 24 aprile 2017, n. 50, convertito, con modificazioni, dalla legge 21 giugno 2017, n. 96, sono apportate le seguenti modificazioni:
a) il terzo periodo è sostituito dal seguente: « Nell'ambito dei processi di statizzazione e razionalizzazione, con decreto del Presidente del Consiglio dei ministri, di concerto con il Ministro dell'università e della ricerca e con il Ministro dell'economia e delle finanze, sono definiti criteri per la determinazione delle relative dotazioni organiche nei limiti massimi del personale in servizio alla data del 24 giugno 2017 presso le predette istituzioni anche con contratto di lavoro flessibile, nonché per il graduale inquadramento nei ruoli dello Stato del personale docente e non docente in servizio a tempo determinato e indeterminato alla data di entrata in vigore della legge di conversione del presente decreto »;
b) dopo il quarto periodo è aggiunto il seguente: « Completato l'inquadramento di cui al terzo periodo, nei limiti delle dotazioni organiche e delle risorse ancora disponibili, nel rispetto dei criteri di cui al predetto decreto, ovvero di analogo decreto adottato ai sensi del terzo periodo, può altresì essere inquadrato il personale, anche con contratto di lavoro flessibile, in servizio alla data del 1° dicembre 2020 ».
",
"888. All'esito dell'adozione del decreto di cui all'articolo 22-bis, comma 2, del decreto-legge 24 aprile 2017, n. 50, convertito, con modificazioni, dalla legge 21 giugno 2017, n. 96, come modificato dal comma 887 del presente articolo, e al fine di corrispondere alle esigenze formative, le dotazioni organiche delle istituzioni statali di alta formazione artistica, musicale e coreutica, comprese quelle definite ai sensi del predetto comma 2, sono incrementate a decorrere dal 1° novembre 2021.",
"889. Ai fini del comma 888 è autorizzata la spesa di 12 milioni di euro per l'anno 2021 e di 70 milioni di euro annui a decorrere dall'anno 2022 da destinare all'ampliamento della dotazione organica delle istituzioni ivi previste, cui si provvede a valere sulle risorse del fondo di cui al comma 854.",
"890. Nelle more della piena attuazione del regolamento di cui al decreto del Presidente della Repubblica 7 agosto 2019, n. 143, le cui disposizioni si applicano a decorrere dall'anno accademico 2022/2023, l'attribuzione di incarichi a tempo indeterminato per i profili di docente avviene prioritariamente a valere sulle vigenti graduatorie nazionali per titoli e in subordine sulle graduatorie di cui all'articolo 3-quater comma 3, del decreto-legge 9 gennaio 2020, n. 1, convertito, con modificazioni, dalla legge 5 marzo 2020, n. 12. Con decreto del Ministro dell'università e della ricerca, di concerto con il Ministro dell'economia e delle finanze, sono definiti i criteri e le quantità numeriche, suddivise tra personale docente e non docente, da assegnare a ciascuna istituzione.",
"891. Dall'anno accademico 2021/2022, ferma restando la durata dei contratti in essere, gli incarichi di docenza non rientranti nelle dotazioni organiche delle istituzioni statali di alta formazione artistica, musicale e coreutica, compresi quelli di cui all'articolo 1, comma 284, della legge 27 dicembre 2019, n. 160, sono ridotti in proporzione al numero di nuovi docenti introdotti in organico ai sensi del comma 888 del presente articolo. Per le finalità di cui al presente comma, le istituzioni statali di alta formazione artistica, musicale e coreutica effettuano, entro il 1° aprile 2021, una ricognizione degli incarichi di cui al primo periodo del presente comma. Il decreto di riparto di cui al comma 890 del presente articolo tiene conto degli esiti di tale ricognizione. Alle istituzioni che non abbiano effettuato la ricognizione non possono essere attribuiti ampliamenti della dotazione organica ai sensi del comma 888.",
"892. Al fine di prevedere, nelle dotazioni organiche delle istituzioni statali di alta formazione artistica, musicale e coreutica, le posizioni di accompagnatore al pianoforte, di accompagnatore al clavicembalo e di tecnico di laboratorio, nello stato di previsione del Ministero dell'università e della ricerca è istituito uno specifico fondo, con una dotazione pari a 2,5 milioni di euro per l'anno 2021 e a 15 milioni di euro annui a decorrere dall'anno 2022. Il rapporto di lavoro del personale di cui al primo periodo è disciplinato nell'ambito del contratto collettivo nazionale di lavoro del comparto istruzione e ricerca, in un'apposita sezione, con definizione dei trattamenti economici dei relativi profili, prendendo a riferimento l'inquadramento economico di tali figure tecniche in misura pari all'attuale profilo EP1 del comparto. Con decreto del Ministro dell'università e della ricerca sono definiti, nel rispetto delle condizioni e delle modalità di reclutamento stabilite dall'articolo 35 del decreto legislativo 30 marzo 2001, n. 165, e dall'articolo 19, comma 3-bis, del decreto-legge 12 settembre 2013, n. 104, convertito, con modificazioni, dalla legge 8 novembre 2013, n. 128, i requisiti, i titoli e le procedure concorsuali per le assunzioni di cui al presente comma, nonché i criteri di riparto del fondo tra le istituzioni statali di alta formazione artistica, musicale e coreutica.",
"893. All'articolo 1, comma 654, della legge 27 dicembre 2017, n. 205, dopo il terzo periodo sono aggiunti i seguenti: « Fino all'applicazione delle disposizioni del predetto regolamento le procedure per il passaggio alla prima fascia riservate ai docenti di seconda fascia in servizio a tempo indeterminato sono attuate nell'ambito delle procedure di reclutamento e sono disciplinate con decreto del Ministro dell'università e della ricerca. Il predetto decreto, nei limiti delle risorse già accantonate a tal fine negli anni accademici 2018/2019, 2019/2020 e 2020/2021, può prevedere la trasformazione di tutte le cattedre di seconda fascia in cattedre di prima fascia. La quota residua delle predette risorse, in seguito alla trasformazione di tutte le cattedre, può essere destinata, con decreto del Ministro dell'università e della ricerca, di concerto con il Ministro dell'economia e delle finanze e con il Ministro per la pubblica amministrazione, al reclutamento di direttori amministrativi per le istituzioni di cui al comma 653 nonché alla determinazione e all'ampliamento delle dotazioni organiche dell'Istituto superiore di studi musicali Gaetano Braga di Teramo e degli istituti superiori per le industrie artistiche (ISIA) ».",
"894. All'articolo 1, comma 285, della legge 27 dicembre 2019, n. 160, dopo le parole: « al personale in servizio di ruolo » sono inserite le seguenti: « nella medesima istituzione ».",
"895. Al fine di dare attuazione alle disposizioni della legge 11 gennaio 2018, n. 7, l'Agenzia spaziale italiana può procedere annualmente all'assunzione di personale con oneri a carico del proprio bilancio fino al conseguimento del valore soglia di cui al comma 896 del presente articolo, con un incremento annuale della spesa di personale non superiore al 25 per cento, ferma restando la capacità di sostenere la spesa a regime verificata dall'organo interno di controllo. In caso di indicatore superiore al valore soglia, come definito al comma 896, l'Agenzia adotta un percorso di graduale riduzione annuale del valore dell'indicatore fino al conseguimento, entro l'anno 2025, del predetto valore soglia. A decorrere dall'anno 2025, in caso di indicatore superiore al limite di cui al comma 896, l'Agenzia non può procedere ad assunzioni di personale fino al conseguimento del predetto valore soglia. L'Agenzia, al fine di assicurare il rispetto dell'indicatore, la sostenibilità a regime della spesa per il personale e gli equilibri di bilancio, definisce le proprie esigenze assunzionali tenendo anche conto della dinamica retributiva collegata al riconoscimento delle fasce stipendiali previste dalla contrattazione collettiva nazionale.",
"896. L'indicatore del limite delle spese per il personale è calcolato annualmente rapportando le spese complessive per il personale derivanti da rapporti di lavoro subordinato e da forme di lavoro flessibile, comprensive degli oneri a carico dell'amministrazione, registrate nell'ultimo bilancio approvato, alla media delle entrate correnti come risultanti dagli ultimi tre bilanci consuntivi approvati. Tale rapporto non può superare il valore soglia del 70 per cento.",
