"582. In ragione dell'emergenza epidemiologica da COVID-19 e delle misure restrittive adottate e allo scopo di razionalizzare gli interventi e le attività di tutela e di valorizzazione del patrimonio culturale immateriale, con decreto del Ministro per i beni e le attività culturali e per il turismo, di concerto con il Ministro delle politiche agricole alimentari e forestali e con il Ministro dell'economia e delle finanze, è istituito, presso il Ministero per i beni e le attività culturali e per il turismo, l'Osservatorio nazionale per il patrimonio immateriale dell'UNESCO. A tale fine è autorizzata la spesa di 500.000 euro annui a decorrere dall'anno 2021, che costituisce limite massimo di spesa. Ai componenti dell'Osservatorio non spettano indennità, compensi, gettoni di presenza o rimborsi spese. Alle eventuali spese di funzionamento del predetto Osservatorio si provvede nel limite dell'autorizzazione di spesa di cui al secondo periodo.",
"583. Alla legge 14 novembre 2016, n. 220, sono apportate le seguenti modificazioni:
a) all'articolo 13, comma 2, secondo periodo, le parole: « 400 milioni » sono sostituite dalle seguenti: « 640 milioni »;
b) all'articolo 15, le parole: « 30 per cento », ovunque ricorrono, sono sostituite dalle seguenti: « 40 per cento »;
c) all'articolo 16:
1) al comma 1, le parole: « 30 per cento, elevata al 40 per cento nei casi previsti nel presente articolo, » sono sostituite dalle seguenti: « 40 per cento »;
2) il comma 2 è abrogato;
d) all'articolo 19, comma 1, le parole: « 30 per cento » sono sostituite dalle seguenti: « 40 per cento »;
e) all'articolo 21:
1) al comma 1, le parole: « I crediti d'imposta di cui alla presente sezione sono riconosciuti » sono sostituite dalle seguenti: « I crediti d'imposta di cui alla presente sezione, ad esclusione di quelli di cui agli articoli 15 e 19, sono riconosciuti »;
2) dopo il comma 5 è inserito il seguente:
« 5-bis. Il Ministro, tenuto conto dell'andamento del mercato nel settore del cinema e dell'audiovisivo, può adottare, nel limite delle risorse individuate con il decreto di cui all'articolo 13, comma 5, uno o più decreti ai sensi del comma 5 del presente articolo, anche in deroga alle percentuali previste per i crediti d'imposta di cui alla presente sezione e al limite massimo stabilito dal comma 1 del presente articolo ».
",
"584. Ai sensi dell'articolo 17, comma 12, della legge 31 dicembre 2009, n. 196, il Ministro dell'economia e delle finanze provvede al monitoraggio degli oneri derivanti dall'attuazione delle disposizioni di cui al comma 583. Nel caso di scostamenti rispetto alle previsioni, il Ministro dell'economia e delle finanze provvede mediante riduzione, nella misura necessaria alla copertura finanziaria del maggior onere risultante dall'attività di monitoraggio, del Fondo per lo sviluppo degli investimenti nel cinema e nell'audiovisivo di cui all'articolo 13 della legge 14 novembre 2016, n. 220.",
"585. A decorrere dal 1° gennaio 2021, l'Istituto Luce Cinecittà Srl è trasformato nella società per azioni Istituto Luce Cinecittà Spa, che succede in tutti i rapporti attivi e passivi facenti capo all'Istituto Luce Cinecittà Srl alla medesima data.",
"586. Le azioni dell'Istituto Luce Cinecittà Spa sono attribuite al Ministero dell'economia e delle finanze. I diritti dell'azionista sono esercitati dal Ministero per i beni e le attività culturali e per il turismo, d'intesa con il Ministero dell'economia e delle finanze.",
"587. L'Istituto Luce Cinecittà Spa è amministrato da un consiglio di amministrazione composto da cinque membri, di cui due designati dal Ministro dell'economia e delle finanze, uno dei quali con funzioni di presidente, designato d'intesa con il Ministro per i beni e le attività culturali e per il turismo, e tre, uno dei quali con funzioni di amministratore delegato, designati dal Ministro per i beni e le attività culturali e per il turismo.",
"588. Alla data del 1° gennaio 2021 di cui al comma 585, il capitale dell'Istituto Luce Cinecittà Spa è pari alla somma del netto patrimoniale risultante dal bilancio di chiusura dell'Istituto Luce Cinecittà Srl alla data del 31 dicembre 2020. Per l'anno 2021, il Ministero dell'economia e delle finanze è autorizzato ad aumentare il capitale sociale dell'Istituto Luce Cinecittà Spa di un importo pari a 10 milioni di euro.",
"589. Per le fondazioni lirico-sinfoniche che, alla data di entrata in vigore della presente legge, hanno presentato il piano di risanamento, ai sensi dell'articolo 11 del decreto-legge 8 agosto 2013, n. 91, convertito, con modificazioni, dalla legge 7 ottobre 2013, n. 112, nonché dell'articolo 1, commi 355 e 356, della legge 28 dicembre 2015, n. 208, continuano ad applicarsi, fino all'approvazione del bilancio d'esercizio dell'anno 2021, le disposizioni del comma 3 del citato articolo 11 del decreto-legge n. 91 del 2013 concernenti i contenuti inderogabili dei piani di risanamento, nonché gli obiettivi generali già definiti nelle azioni e nelle misure pianificate nei piani di risanamento e nelle loro successive integrazioni. Le fondazioni di cui al presente comma per le quali non sia stato raggiunto, entro l'esercizio 2021, il pareggio economico e il tendenziale equilibrio patrimoniale e finanziario sono poste in liquidazione coatta amministrativa.",
"590. Alla procedura di cui all'articolo 11 del decreto-legge 8 agosto 2013, n. 91, convertito, con modificazioni, dalla legge 7 ottobre 2013, n. 112, possono accedere anche le fondazioni lirico-sinfoniche che, alla data di entrata in vigore della presente legge, non abbiano già presentato un piano di risanamento ai sensi del medesimo articolo 11, nonché dell'articolo 1, commi 355 e 356, della legge 28 dicembre 2015, n. 208. A tale fine le fondazioni interessate possono presentare, entro novanta giorni dalla data di entrata in vigore della presente legge, un piano di risanamento triennale per il periodo 2021-2023, predisposto secondo le disposizioni di cui al citato articolo 11 del decreto-legge n. 91 del 2013 e le linee guida adottate per la redazione dei piani di risanamento. Per l'attuazione del presente comma, il fondo di rotazione di cui al medesimo articolo 11, comma 6, del decreto-legge n. 91 del 2013 è incrementato, per l'anno 2021, di 40 milioni di euro. Per l'erogazione delle risorse si applicano le disposizioni del comma 7 del citato articolo 11 del decreto-legge n. 91 del 2013. Per i piani di cui al presente comma, ai fini della definizione delle misure di cui alle lettere a) e c) del comma 1 del citato articolo 11 del decreto-legge n. 91 del 2013, si fa riferimento rispettivamente al debito esistente alla data del 31 dicembre 2019 e alla dotazione organica in essere alla data del 31 dicembre 2019. Le fondazioni di cui al presente comma sono tenute a raggiungere il pareggio economico in ciascun esercizio e, entro l'esercizio finanziario 2023, il tendenziale equilibrio patrimoniale e finanziario. Le fondazioni per le quali non sia stato presentato o non sia stato approvato un piano di risanamento nei termini stabiliti ovvero non sia stato raggiunto il pareggio economico in ciascun esercizio e, entro l'esercizio 2023, il tendenziale equilibrio patrimoniale e finanziario sono poste in liquidazione coatta amministrativa. (99) (99) Comma così modificato dall'art. 65, comma 8, D.L. 25 maggio 2021, n. 73, convertito, con modificazioni, dalla L. 23 luglio 2021, n. 106.",
"591. Ai fini del perfezionamento con le Agenzie fiscali delle transazioni di cui all'articolo 182-ter del regio decreto 16 marzo 1942, n. 267, ai piani di risanamento presentati dalle fondazioni ai sensi dei commi 589 e 590 del presente articolo si applica quanto disposto dall'articolo 5, comma 1-bis, del decreto-legge 31 maggio 2014, n. 83, convertito, con modificazioni, dalla legge 29 luglio 2014, n. 106.",
"592. Le funzioni del commissario straordinario di cui all'articolo 11, comma 3, del decreto-legge 8 agosto 2013, n. 91, convertito, con modificazioni, dalla legge 7 ottobre 2013, n. 112, sono prorogate fino al 31 dicembre 2022, al fine di proseguire l'attività di monitoraggio dei piani di risanamento delle fondazioni lirico-sinfoniche di cui al comma 589 del presente articolo, e fino al 31 dicembre 2023, al fine di consentire la realizzazione delle attività concernenti l'approvazione e il monitoraggio dei nuovi piani di risanamento ove presentati in attuazione di quanto stabilito dal comma 590 del presente articolo. Il relativo incarico è conferito con le modalità di cui al citato articolo 11, commi 3 e 5, del decreto-legge n. 91 del 2013. A supporto delle attività del commissario straordinario, la Direzione generale spettacolo del Ministero per i beni e le attività culturali e per il turismo può conferire incarichi di collaborazione, ai sensi dell'articolo 7, comma 6, del decreto legislativo 30 marzo 2001, n. 165, a persone di comprovata qualificazione professionale nella gestione amministrativa e contabile di enti ovvero nella pianificazione strategica della loro attività, entro il limite di spesa complessivo di 100.000 euro annui e per la durata massima di ventiquattro mesi e comunque con scadenza finale al 31 dicembre 2022, prorogabili per ulteriori dodici mesi, nel caso in cui le funzioni del commissario straordinario siano prorogate fino al 31 dicembre 2023.",
"593. Ai fini dell'attuazione dei commi da 589 a 592 è autorizzata una spesa pari a 40,1 milioni di euro per l'anno 2021 e a 100.000 euro per ciascuno degli anni 2022 e 2023.",
"594. Il compenso del commissario straordinario di cui al comma 592 del presente articolo, nel limite massimo stabilito dall'articolo 15, comma 3, del decreto-legge 6 luglio 2011, n. 98, convertito, con modificazioni, dalla legge 15 luglio 2011, n. 111, è posto a valere sulle risorse di bilancio delle fondazioni ammesse alla procedura di cui ai commi 589 e 590 del presente articolo.",
"595. Il regime fiscale delle locazioni brevi di cui all'articolo 4, commi 2 e 3, del decreto-legge 24 aprile 2017, n. 50, convertito, con modificazioni, dalla legge 21 giugno 2017, n. 96, con effetto dal periodo d'imposta relativo all'anno 2021, è riconosciuto solo in caso di destinazione alla locazione breve di non più di quattro appartamenti per ciascun periodo d'imposta. Negli altri casi, ai fini della tutela dei consumatori e della concorrenza, l'attività di locazione di cui al presente comma, da chiunque esercitata, si presume svolta in forma imprenditoriale ai sensi dell'articolo 2082 del codice civile. Le disposizioni del presente comma si applicano anche per i contratti stipulati tramite soggetti che esercitano attività di intermediazione immobiliare, ovvero tramite soggetti che gestiscono portali telematici, mettendo in contatto persone in cerca di un immobile con persone che dispongono di appartamenti da condurre in locazione.",
"596. Il comma 3-bis dell'articolo 4 del decreto-legge 24 aprile 2017, n. 50, convertito, con modificazioni, dalla legge 21 giugno 2017, n. 96, è abrogato.",
"597. All'articolo 13-quater del decreto-legge 30 aprile 2019, n. 34, convertito, con modificazioni, dalla legge 28 giugno 2019, n. 58, sono apportate le seguenti modificazioni:
a) il comma 4 è sostituito dal seguente:
« 4. Ai fini della tutela dei consumatori, presso il Ministero per i beni e le attività culturali e per il turismo è istituita una banca di dati delle strutture ricettive, nonché degli immobili destinati alle locazioni brevi ai sensi dell'articolo 4 del decreto-legge 24 aprile 2017, n. 50, convertito, con modificazioni, dalla legge 21 giugno 2017, n. 96, identificati mediante un codice da utilizzare in ogni comunicazione inerente all'offerta e alla promozione dei servizi all'utenza, fermo restando quanto stabilito in materia dalle leggi regionali. La banca di dati raccoglie e ordina le informazioni inerenti alle strutture ricettive e agli immobili di cui al presente comma. Le regioni e le province autonome di Trento e di Bolzano trasmettono al Ministero per i beni e le attività culturali e per il turismo i dati inerenti alle strutture ricettive e agli immobili di cui al presente comma con i relativi codici identificativi regionali, ove adottati. Con decreto del Ministro per i beni e le attività culturali e per il turismo, da adottare entro sessanta giorni dalla data di entrata in vigore della presente disposizione, sono stabilite le modalità di realizzazione e di gestione della banca di dati e di acquisizione dei codici identificativi regionali nonché le modalità di accesso alle informazioni che vi sono contenute »;
b) i commi 5 e 6 sono abrogati;
c) al comma 7, dopo le parole: « strutture ricettive, » sono inserite le seguenti: « i soggetti che concedono in locazione breve immobili ad uso abitativo, ai sensi dell'articolo 4 del decreto-legge 24 aprile 2017, n. 50, convertito, con modificazioni, dalla legge 21 giugno 2017, n. 96, » e le parole: « il codice identificativo » sono sostituite dalle seguenti: « i codici di cui al comma 4 ».
",
"598. All'articolo 32, comma 1, del decreto-legge 12 settembre 2014, n. 133, convertito, con modificazioni, dalla legge 11 novembre 2014, n. 164, le parole: « , con esclusione dei servizi resi nell'ambito di contratti annuali o pluriennali per lo stazionamento » sono soppresse.",
"599. In considerazione degli effetti connessi all'emergenza epidemiologica da COVID-19, per l'anno 2021 non è dovuta la prima rata dell'imposta municipale propria di cui all'articolo 1, commi da 738 a 783, della legge 27 dicembre 2019, n. 160, relativa a:
a) immobili adibiti a stabilimenti balneari marittimi, lacuali e fluviali, nonché immobili degli stabilimenti termali;
b) immobili rientranti nella categoria catastale D/2 e relative pertinenze, immobili degli agriturismi, dei villaggi turistici, degli ostelli della gioventù, dei rifugi di montagna, delle colonie marine e montane, degli affittacamere per brevi soggiorni, delle case e appartamenti per vacanze, dei bed and breakfast, dei residence e dei campeggi, a condizione che i relativi soggetti passivi, come individuati dall'articolo 1, comma 743, della legge 27 dicembre 2019, n. 160, siano anche gestori delle attività ivi esercitate;
c) immobili rientranti nella categoria catastale D in uso da parte di imprese esercenti attività di allestimenti di strutture espositive nell'ambito di eventi fieristici o manifestazioni;
d) immobili destinati a discoteche, sale da ballo, night club e simili, a condizione che i relativi soggetti passivi, come individuati dall'articolo 1, comma 743, della legge 27 dicembre 2019, n. 160, siano anche gestori delle attività ivi esercitate. (100)
(100) Sulle modalità di fruizione degli aiuti di cui al presente comma vedi l'art. 1, comma 13, lett. g), D.L. 22 marzo 2021, n. 41, convertito, con modificazioni, dalla L. 21 maggio 2021, n. 69.
",
"600. Le disposizioni del comma 599 si applicano nel rispetto dei limiti e delle condizioni previsti dalla comunicazione della Commissione europea C(2020) 1863 final « Quadro temporaneo per le misure di aiuto di Stato a sostegno dell'economia nell'attuale emergenza del COVID-19 », pubblicata nella Gazzetta Ufficiale dell'Unione europea C 091I del 20 marzo 2020.",
"601. Per il ristoro ai comuni delle minori entrate derivanti dal comma 599 del presente articolo, il fondo di cui all'articolo 177, comma 2, del decreto-legge 19 maggio 2020, n. 34, convertito, con modificazioni, dalla legge 17 luglio 2020, n. 77, è incrementato di 79,1 milioni di euro per l'anno 2021. Alla ripartizione dell'incremento di cui al primo periodo si provvede con uno o più decreti del Ministro dell'interno, di concerto con il Ministro dell'economia e delle finanze, previa intesa in sede di Conferenza Stato-città ed autonomie locali, da adottare entro sessanta giorni dalla data di entrata in vigore della presente legge, tenuto conto degli effettivi incassi dell'anno 2019.",
"602. All'articolo 28, comma 5, ultimo periodo, del decreto-legge 19 maggio 2020, n. 34, convertito, con modificazioni, dalla legge 17 luglio 2020, n. 77, dopo le parole: « imprese turistico-ricettive » sono inserite le seguenti: « , le agenzie di viaggio e i tour operator » e le parole: « 31 dicembre 2020 » sono sostituite dalle seguenti: « 30 aprile 2021 ».",
"603. All'articolo 182, comma 1, del decreto-legge 19 maggio 2020, n. 34, convertito, con modificazioni, dalla legge 17 luglio 2020, n. 77, dopo la parola: « nonché » sono inserite le seguenti: « le imprese turistico-ricettive, » e dopo le parole: « per l'anno 2020 » sono inserite le seguenti: « e di 100 milioni di euro per l'anno 2021 ».",
"604. L'autorizzazione di spesa di cui all'articolo 79, comma 3, del decreto-legge 14 agosto 2020, n. 104, convertito, con modificazioni, dalla legge 13 ottobre 2020, n. 126, è incrementata di 20 milioni di euro per l'anno 2021.",
"605. Al fine di valorizzare e promuovere il territorio italiano, nello stato di previsione del Ministero dell'economia e delle finanze è istituito un fondo con una dotazione di 500.000 euro per ciascuno degli anni 2021, 2022 e 2023, da trasferire successivamente al bilancio autonomo della Presidenza del Consiglio dei ministri, da destinare all'erogazione di contributi a favore delle regioni e delle province autonome di Trento e di Bolzano per l'organizzazione di gare sportive atletiche, ciclistiche e automobilistiche di rilievo internazionale che si svolgano nel territorio di almeno due regioni.",
"606. Il Ministro per le politiche giovanili e lo sport, con proprio decreto, definisce le modalità di riparto delle risorse del fondo di cui al comma 605.",
"607. Per le finalità di cui al comma 605 del presente articolo, all'articolo 9, comma 1, del codice della strada, di cui al decreto legislativo 30 aprile 1992, n. 285, dopo il terzo periodo è inserito il seguente: « Per le gare atletiche, ciclistiche e quelle con animali o con veicoli a trazione animale che interessano il territorio di più regioni, l'autorizzazione è rilasciata dalla regione o dalla provincia autonoma del luogo di partenza, d'intesa con le altre regioni interessate, che devono rilasciare il nulla osta entro il termine di venti giorni antecedenti alla data di effettuazione della gara ».",
"608. Dopo il comma 1-ter dell'articolo 57-bis del decreto-legge 24 aprile 2017, n. 50, convertito, con modificazioni, dalla legge 21 giugno 2017, n. 96, è inserito il seguente:
« 1-quater. Per gli anni 2021 e 2022, il credito d'imposta di cui al comma 1 è concesso, ai medesimi soggetti ivi previsti, nella misura unica del 50 per cento del valore degli investimenti pubblicitari effettuati sui giornali quotidiani e periodici, anche in formato digitale, entro il limite massimo di 50 milioni di euro per ciascuno degli anni 2021 e 2022. Alla copertura del relativo onere si provvede mediante corrispondente riduzione delle risorse del Fondo per il pluralismo e l'innovazione dell'informazione, di cui all'articolo 1 della legge 26 ottobre 2016, n. 198, nell'ambito della quota spettante alla Presidenza del Consiglio dei ministri. Ai fini della concessione del credito d'imposta si applicano le disposizioni del comma 1-ter del presente articolo e del regolamento di cui al decreto del Presidente del Consiglio dei ministri 16 maggio 2018, n. 90. Per le finalità di cui al presente comma, il Fondo per il pluralismo e l'innovazione dell'informazione, di cui al citato articolo 1 della legge n. 198 del 2016, è incrementato di 50 milioni di euro per ciascuno degli anni 2021 e 2022 ».",
"609. Per gli anni 2021 e 2022, agli esercenti attività commerciali che operano esclusivamente nel settore della vendita al dettaglio di giornali, riviste e periodici e alle imprese di distribuzione della stampa che riforniscono di giornali quotidiani o periodici rivendite situate nei comuni con popolazione inferiore a 5.000 abitanti e nei comuni con un solo punto vendita è riconosciuto il credito d'imposta di cui all'articolo 1, commi da 806 a 809, della legge 30 dicembre 2018, n. 145, alle condizioni e con le modalità ivi previste per l'anno 2020, nel limite massimo di spesa di 15 milioni di euro per ciascuno degli anni 2021 e 2022. Fermo restando il suddetto limite di spesa, per gli anni 2021 e 2022 il credito d'imposta può essere altresì parametrato agli importi spesi per l'acquisto o il noleggio di registratori di cassa o registratori telematici e di dispositivi POS. Alla copertura dell'onere derivante dall'attuazione del presente comma si provvede mediante corrispondente riduzione delle risorse del Fondo per il pluralismo e l'innovazione dell'informazione, di cui all'articolo 1 della legge 26 ottobre 2016, n. 198, nell'ambito della quota delle risorse del Fondo destinata agli interventi di competenza della Presidenza del Consiglio dei ministri. Per le predette finalità il suddetto Fondo è incrementato di 15 milioni di euro per ciascuno degli anni 2021 e 2022. Le risorse destinate al riconoscimento del credito d'imposta di cui al presente comma sono iscritte nel pertinente capitolo dello stato di previsione del Ministero dell'economia e delle finanze e sono trasferite nella contabilità speciale n. 1778 « Agenzia delle entrate - fondi di bilancio » per le necessarie regolazioni contabili. (101)
(101) Comma così modificato dall'art. 67, comma 8, D.L. 25 maggio 2021, n. 73, convertito, con modificazioni, dalla L. 23 luglio 2021, n. 106. ",
"610. Per gli anni 2021 e 2022, il credito d'imposta per i servizi digitali di cui all'articolo 190 del decreto-legge 19 maggio 2020, n. 34, convertito, con modificazioni, dalla legge 17 luglio 2020, n. 77, è riconosciuto, alle condizioni e con le modalità ivi previste, entro il limite massimo di 10 milioni di euro per ciascuno degli anni 2021 e 2022. Agli oneri derivanti dall'attuazione del presente comma, pari a 10 milioni di euro per ciascuno degli anni 2021 e 2022, si provvede a valere sul Fondo per il pluralismo e l'innovazione dell'informazione, di cui all'articolo 1 della legge 26 ottobre 2016, n. 198, nell'ambito della quota destinata agli interventi di competenza della Presidenza del Consiglio dei ministri. Per le predette finalità il suddetto Fondo è incrementato di 10 milioni di euro per ciascuno degli anni 2021 e 2022. Le risorse destinate al riconoscimento del credito d'imposta di cui al presente comma sono iscritte nel pertinente capitolo dello stato di previsione del Ministero dell'economia e delle finanze e sono trasferite nella contabilità speciale n. 1778 « Agenzia delle entrate - fondi di bilancio » per le necessarie regolazioni contabili.",
"611. Al comma 357 dell'articolo 1 della legge 27 dicembre 2019, n. 160, dopo la parola: « quotidiani » sono inserite le seguenti: « e periodici ».",
"[612. Al fine di sostenere l'accesso delle famiglie a basso reddito ai servizi informativi, in via sperimentale per gli anni 2021 e 2022, ai nuclei familiari con un valore dell'indicatore della situazione economica equivalente inferiore a 20.000 euro che beneficiano del voucher per l'acquisizione dei servizi di connessione alla rete internet in banda ultra larga e dei relativi dispositivi elettronici, ai sensi del decreto del Ministro dello sviluppo economico 7 agosto 2020, pubblicato nella Gazzetta Ufficiale n. 243 del 1° ottobre 2020, è riconosciuto un contributo aggiuntivo, dell'importo massimo di 100 euro, sotto forma di sconto sul prezzo di vendita di abbonamenti a quotidiani, riviste o periodici, anche in formato digitale, entro il limite massimo di 25 milioni di euro per ciascuno degli anni 2021 e 2022. Il contributo è utilizzabile per acquisti effettuati on line ovvero presso gli esercenti attività commerciali che operano esclusivamente nel settore della vendita al dettaglio di giornali, riviste e periodici, secondo le modalità operative stabilite ai sensi del comma 613. ] 
(102) Comma abrogato dall'art. 67, comma 11, D.L. 25 maggio 2021, n. 73, convertito, con modificazioni, dalla L. 23 luglio 2021, n. 106. ",
"[613. Ai fini dell'erogazione del contributo di cui al comma 612 del presente articolo si applicano, per quanto compatibili, le disposizioni del decreto del Ministro dello sviluppo economico 7 agosto 2020, pubblicato nella Gazzetta Ufficiale n. 243 del 1° ottobre 2020. Con decreto del Presidente del Consiglio dei ministri o del Sottosegretario di Stato con delega all'informazione e all'editoria, di concerto con il Ministro dell'economia e delle finanze e con il Ministro dello sviluppo economico, sentito il Ministro per l'innovazione tecnologica e la digitalizzazione, da adottare entro trenta giorni dalla data di entrata in vigore della presente legge, sono stabilite le disposizioni di attuazione del comma 612. ]
(103) Comma abrogato dall'art. 67, comma 11, D.L. 25 maggio 2021, n. 73, convertito, con modificazioni, dalla L. 23 luglio 2021, n. 106.",
"614. Allo scopo di favorire il rinnovo o la sostituzione del parco degli apparecchi televisivi non idonei alla ricezione dei programmi con le nuove tecnologie DVB-T2 e di favorire il corretto smaltimento degli apparecchi obsoleti, attraverso il riciclo, ai fini di tutela ambientale e di promozione dell'economia circolare, di apparecchiature elettriche ed elettroniche ai sensi del decreto legislativo 14 marzo 2014, n. 49, il contributo di cui all'articolo 1, comma 1039, lettera c), della legge 27 dicembre 2017, n. 205, è esteso all'acquisto e allo smaltimento di apparecchiature di ricezione televisiva. Per l'esercizio finanziario 2021 le risorse di cui all'articolo 1, comma 1039, lettera c), della legge 27 dicembre 2017, n. 205, sono incrementate per un importo di 100 milioni di euro che costituisce limite di spesa.",
